"Tian Y., Suki N.M., Omar A.C.","Two Decades of Digital Storytelling: A Comprehensive Bibliometric Analysis",2021,"19th IEEE Student Conference on Research and Development: Sustainable Engineering and Technology towards Industry Revolution, SCOReD 2021",,"10.1109/SCOReD53546.2021.9652751","https://www.scopus.com/inward/record.uri?eid=2-s2.0-85124381681&doi=10.1109%2fSCOReD53546.2021.9652751&partnerID=40&md5=a811c6a3ba54d0dbee5bff1d2deeef24","bibliometric analysis; Digital storytelling; Scopus","English",Conference Paper,Scopus
"Álvarez-Tardío B.","ADELINA GURREA AND THE CONSTRUCTION OF SPANISH LITERATURE DURING FRANCO’S DICTATORSHIP",2021,"Kritika Kultura",,"10.13185/KK2021.003717","https://www.scopus.com/inward/record.uri?eid=2-s2.0-85124366392&doi=10.13185%2fKK2021.003717&partnerID=40&md5=e293fd333a3fb9a97dae646ab52d857a","Corpus linguistics; Digital humanities; Hispanic-Philippine literature; Nadal prize for literature; Spanish women writers","English",Article,Scopus
"Ciorogar A., Codină J.B., Văsieș A., Pojoga V., Baghiu Ș., Martin A.-S.","Nature in the Romanian Novel (1845-1947) [Natura în romanul românesc (1845-1947)]",2021,"Revista Transilvania",3,"10.51391/TRVA.2021.09.07","https://www.scopus.com/inward/record.uri?eid=2-s2.0-85124293768&doi=10.51391%2fTRVA.2021.09.07&partnerID=40&md5=cfc38316f5e01757b5ab426d04828428","Digital humanities; Ecology; History of the novel; Post-anthropocentrism; Romanian literature; Zoopoetics","Romanian; Moldavian; Moldovan",Article,Scopus
"Sumikawa Y., Ikejiri R., Doucet A., Pfanzelter E., Hasanuzzaman M., Dias G., Milligan I., Jatowt A.","HistoInformatics2021: The 6thInternational Workshop on Computational History",2021,"Proceedings of the ACM/IEEE Joint Conference on Digital Libraries",,"10.1109/JCDL52503.2021.00072","https://www.scopus.com/inward/record.uri?eid=2-s2.0-85124215799&doi=10.1109%2fJCDL52503.2021.00072&partnerID=40&md5=d4f3394e280533c54771dc85696f754a","computational history; digital history; digital humanities","English",Conference Paper,Scopus
"Cobb P.J., Woo E.M.W., Pan N.F.C., Lou V.W.Q., Hu X., Cheng M., Xiao J.","Sharing the Past: The Library as Digital Co-Design Space for Intergenerational Heritage Preservation",2021,"Proceedings of the ACM/IEEE Joint Conference on Digital Libraries",,"10.1109/JCDL52503.2021.00051","https://www.scopus.com/inward/record.uri?eid=2-s2.0-85124210020&doi=10.1109%2fJCDL52503.2021.00051&partnerID=40&md5=c3cbae441ba6655c03bff0ffc0121c8b","Aging Society; Cultural Heritage Preservation; Digital Humanities; Intergenerational Collaboration","English",Conference Paper,Scopus
"Li W., Wang F., Wang J.","Exploring the Classification of Traditional Chinese Bibliographies through Interactive Visualization",2021,"Proceedings of the ACM/IEEE Joint Conference on Digital Libraries",,"10.1109/JCDL52503.2021.00071","https://www.scopus.com/inward/record.uri?eid=2-s2.0-85124200252&doi=10.1109%2fJCDL52503.2021.00071&partnerID=40&md5=9e902e9c07df8daf348b5c10fa45614e","digital humanities; interactive visualization; traditional Chinese bibliographies","English",Conference Paper,Scopus
"Jiang M., Hu Y., Worthey G., Dubnicek R.C., Underwood T., Downie J.S.","Evaluating BERT's Encoding of Intrinsic Semantic Features of OCR'd Digital Library Collections",2021,"Proceedings of the ACM/IEEE Joint Conference on Digital Libraries",1,"10.1109/JCDL52503.2021.00045","https://www.scopus.com/inward/record.uri?eid=2-s2.0-85124198418&doi=10.1109%2fJCDL52503.2021.00045&partnerID=40&md5=6fa30a3d716e2c058ff332a19353065b","BERT Evaluation; Data Curation; Digital Humanities; Digital Libraries; HathiTrust; Intrinsic Semantic Features; Optical Character Recognition; Parallel Corpus; Word Embeddings","English",Conference Paper,Scopus
"Fang Z., He Y., Procter R.","A Query-Driven Topic Model",2021,"Findings of the Association for Computational Linguistics: ACL-IJCNLP 2021",,,"https://www.scopus.com/inward/record.uri?eid=2-s2.0-85123928120&partnerID=40&md5=a683e3effc337334bedec1795eb038e2",,"English",Conference Paper,Scopus
"Spence P.J., Brandao R.","Towards Language Sensitivity and Diversity in the Digital Humanities",2021,"Digital Studies/ Le Champ Numerique",,"10.16995/dscn.8098","https://www.scopus.com/inward/record.uri?eid=2-s2.0-85123644576&doi=10.16995%2fdscn.8098&partnerID=40&md5=ba4f79138e375c8d94c73659c54ec072",,"English",Article,Scopus
"Sie S.H., Ke H.R., Chang S.B.","Using Face Detection in Photographs and Cluster Analysis to Support Exploration of Social Relationships Between Historical Personages in a Biographical Database",2021,"Libres",,"10.32655/LIBRES.2021.1.4","https://www.scopus.com/inward/record.uri?eid=2-s2.0-85123615952&doi=10.32655%2fLIBRES.2021.1.4&partnerID=40&md5=b41e812e293a3b095b296c3b732c60bf",,"English",Article,Scopus
"Gagnon J.-P., Asenbaum H., Fleuß D., Bussu S., Guasti P., Dean R., Chalaye P., Alnemr N., Marquardt F., Weiss A.","The Marginalized Democracies of the World",2021,"Democratic Theory",,"10.3167/DT.2021.080201","https://www.scopus.com/inward/record.uri?eid=2-s2.0-85123550785&doi=10.3167%2fDT.2021.080201&partnerID=40&md5=18ce627df45e768c803a142b5f9ad55d","Big data; Democracy; Democratic theory; Democratization; Digital humanities; Google books; Marginalization; Othered","English",Article,Scopus
"Ortega I.F.","Carthaginian coin finds: A database of geolocated numismatic finds [CARTHAGINIANCOINFINDS: UNA BASE DE DATOS SOBRE HALLAZGOS NUMISMÁTICOS GEOLOCALIZADOS]",2021,"Revista Numismatica Hecate",,,"https://www.scopus.com/inward/record.uri?eid=2-s2.0-85123540312&partnerID=40&md5=4cb864967d828ad07cc9a83677411c3b","Carthage; Coin finds; Database; Dédalo; Phoenician-Punic","Spanish",Article,Scopus
"Okada K., Iwata A., Urano Y., Zhou Y., Shibazaki K., Kamiya N.","Initial Study on Multi-Scale Patch-Based Classification of Paper Fibers Based on EfficientNet Using Consumer Digital Camera",2021,"2021 IEEE 10th Global Conference on Consumer Electronics, GCCE 2021",,"10.1109/GCCE53005.2021.9621763","https://www.scopus.com/inward/record.uri?eid=2-s2.0-85123489881&doi=10.1109%2fGCCE53005.2021.9621763&partnerID=40&md5=8da54566edb76e43f255d69f68ce6375","DCNN; digital macro photography; EfficientNet; nondestructive paper analysis","English",Conference Paper,Scopus
"Ulutas Aydogan S., Münster S., Girardi D., Palmirani M., Vitali F.","A Framework to Support Digital Humanities and Cultural Heritage Studies Research",2021,"Communications in Computer and Information Science",1,"10.1007/978-3-030-93186-5_11","https://www.scopus.com/inward/record.uri?eid=2-s2.0-85123430144&doi=10.1007%2f978-3-030-93186-5_11&partnerID=40&md5=56810bd2abd259591249bb6d17d4351d","Cultural heritage; Digitisation; European policy; Legal framework; Research and innovation","English",Conference Paper,Scopus
"De Wilde G.","Towards Completing the Second Edition of the Anglo-Norman Dictionary",2021,"Dictionaries",,"10.1353/DIC.2021.0024","https://www.scopus.com/inward/record.uri?eid=2-s2.0-85123414157&doi=10.1353%2fDIC.2021.0024&partnerID=40&md5=e2e36b296896222e9e3a2df3f1dcdbd2","Anglo-Norman; Digital humanities; Etymology; Historical lexicography; Medieval; Multilingualism; Onomasiology; Semantics","English",Article,Scopus
"Gamallo P., Pichel J.R., Montero Santalha J.M., Neves M.","Use of Linguistic Technologies for Analysing the Evolution of Sufixes -ÇOM and -VEL in Medieval Galician-Portuguese from Historical Corpora [Uso de tecnologias linguísticas para estudar a evolução dos sufixos -ÇOM e -VEL no galego-português medieval a partir de corpora históricos]",2021,"Linguamatica",,"10.21814/LM.13.2.347","https://www.scopus.com/inward/record.uri?eid=2-s2.0-85123404770&doi=10.21814%2fLM.13.2.347&partnerID=40&md5=1775d6406ac354e0ea6cc738ebaad7e9","Digital humanities; Historical linguistics; Language recognizer; Part-of-speech tagging","Portuguese",Article,Scopus
[No author name available],"2nd International Conference on Research and Education in Urban History in the Age of Digital Libraries, UHDL 2019",2021,"Communications in Computer and Information Science",,,"https://www.scopus.com/inward/record.uri?eid=2-s2.0-85123404610&partnerID=40&md5=1fda4112ceeccbff0149c703156ba422",,"English",Conference Review,Scopus
"Toledo-Carvajal V.","Humanidades digitales y la Odisea de Kazantzakis: Una exploración",2021,"Byzantion Nea Hellas",,,"https://www.scopus.com/inward/record.uri?eid=2-s2.0-85123359154&partnerID=40&md5=a8ea01c2e3fc19f535d802a00fd70f69","Digital humanities; Kazantzakis; Odyssey","Spanish",Article,Scopus
"Petteruti A., Nguyen C., Laidlaw D.H.","Designing the Virtual Rosetta: A Tool for Exploring Historical Drawings in VR",2021,"Proceedings - 2021 IEEE 6th Workshop on Visualization for the Digital Humanities, VIS4DH 2021",,"10.1109/VIS4DH53644.2021.00006","https://www.scopus.com/inward/record.uri?eid=2-s2.0-85123185345&doi=10.1109%2fVIS4DH53644.2021.00006&partnerID=40&md5=5f881e4fbe0b24d33a62983987ec3b92","Communication/Presentation; Education; Guidelines; Humanities; Intelligence Analysis; Journalism; Knowledge Work; Methodologies; Social Science; Storytelling","English",Conference Paper,Scopus
[No author name available],"Proceedings - 2021 IEEE 6th Workshop on Visualization for the Digital Humanities, VIS4DH 2021",2021,"Proceedings - 2021 IEEE 6th Workshop on Visualization for the Digital Humanities, VIS4DH 2021",,,"https://www.scopus.com/inward/record.uri?eid=2-s2.0-85123173613&partnerID=40&md5=b2f8d2b7bdc012187700ecec869a7051",,"English",Conference Review,Scopus
"Ciula A., Vieira M., Ferraro G., Ong T., Perovic S., Mucignat R., Valmori N., Deseure B., Mannucci E.J.","Small Data and Process in Data Visualization: The Radical Translations Case Study",2021,"Proceedings - 2021 IEEE 6th Workshop on Visualization for the Digital Humanities, VIS4DH 2021",,"10.1109/VIS4DH53644.2021.00005","https://www.scopus.com/inward/record.uri?eid=2-s2.0-85123164586&doi=10.1109%2fVIS4DH53644.2021.00005&partnerID=40&md5=add16800e314e2adad0acf663c92e741","Applied computing: Arts Humanities; Computing methodologies: Modeling and simulation; Data visualization; Design iterations; Digital Humanities; Human-centered computing: Visualization; Software and its engineering; Software Development Lifecycle","English",Conference Paper,Scopus
"Wang Y., Wang Y., Cao Y., Qu H., Tang J., Wu Y.","Explore Mindfulness Without Deflection: A Data Art Based on the Book of Songs",2021,"Proceedings - 2021 IEEE VIS Arts Program, VISAP 2021",,"10.1109/VISAP52981.2021.00014","https://www.scopus.com/inward/record.uri?eid=2-s2.0-85123163560&doi=10.1109%2fVISAP52981.2021.00014&partnerID=40&md5=78227e30574c4beebc145766d6ca2784","Cultural Heritage; Data Art; Data Visualization; Digital Humanities","English",Conference Paper,Scopus
"Kestemont M.","Middle Dutch studies, millennials and the new millennium: A field in digital leasehold [Medioneerlandistiek, millennials en het nieuwe millennium Een vakgebied in digitale erfpacht]",2021,"Nederlandse Letterkunde",,"10.5117/NEDLET.2021.2-3.008.KEST","https://www.scopus.com/inward/record.uri?eid=2-s2.0-85123160257&doi=10.5117%2fNEDLET.2021.2-3.008.KEST&partnerID=40&md5=6a46c666aa3f6e488b2c38c8cb9adece","Digital Humanities; Digitization; Generational theory; Middle Dutch; Open science","Dutch",Article,Scopus
"Odak M., Miljko A., Papac T.","Digital Transformation in Covid-19 Pandemic - What we Learned and How to Utilize What Was Learned",2021,"2021 44th International Convention on Information, Communication and Electronic Technology, MIPRO 2021 - Proceedings",1,"10.23919/MIPRO52101.2021.9596816","https://www.scopus.com/inward/record.uri?eid=2-s2.0-85123046082&doi=10.23919%2fMIPRO52101.2021.9596816&partnerID=40&md5=f53bf671b6b97ffefa54f0a91d567397","Covid-19; digital transformation; e-learning; emergency remote teaching; higher education","English",Conference Paper,Scopus
"Zlodi G., Zeman M., Marinkovic A., Marusic M.M.","Discovering the Old Dubrovnik Cathedrals: Stone Fragments Analysis, Cataloguing and Structured Terminology Development in Digital Environment",2021,"2021 44th International Convention on Information, Communication and Electronic Technology, MIPRO 2021 - Proceedings",,"10.23919/MIPRO52101.2021.9596949","https://www.scopus.com/inward/record.uri?eid=2-s2.0-85123043627&doi=10.23919%2fMIPRO52101.2021.9596949&partnerID=40&md5=b35678b5f85ebb3ce438eb0b0df2864e","archaeological heritage; cataloguing; database; digital art history; digital humanities; Dubrovnik cathedral; Middle Ages; thesaurus","English",Conference Paper,Scopus
"Trepal D., Lafreniere D., Stone T.","Mapping Historical Archaeology and Industrial Heritage: The Historical Spatial Data Infrastructure",2021,"Journal of Computer Applications in Archaeology",1,"10.5334/jcaa.77","https://www.scopus.com/inward/record.uri?eid=2-s2.0-85123016956&doi=10.5334%2fjcaa.77&partnerID=40&md5=0199a8a62da7c5897b082153262e8324","Big Data; GIS; Heritage; Historical Archaeology; Industrial Archaeology; Spatial Humanities","English",Article,Scopus
"Kunilovskaya M., Plum A.","Text Preprocessing and its Implications in a Digital Humanities Project",2021,"International Conference Recent Advances in Natural Language Processing, RANLP",,"10.26615/issn.2603-2821.2021_013","https://www.scopus.com/inward/record.uri?eid=2-s2.0-85122914831&doi=10.26615%2fissn.2603-2821.2021_013&partnerID=40&md5=f7e865ca5ec53cdae4cc4c4aacfa45c3",,"English",Conference Paper,Scopus
"Uiterwaal F., Niccolucci F., Krauwer S., Hollander H., Admiraal F., Romary L., Bruseker G., Meghini C., Edmond J., Hedges M.","FROM DISPARATE DISCIPLINES TO UNITY IN DIVERSITY: HOW THE PARTHENOS PROJECT HAS BROUGHT EUROPEAN HUMANITIES RESEARCH INFRASTRUCTURES TOGETHER",2021,"International Journal of Humanities and Arts Computing",,"10.3366/IJHAC.2021.0264","https://www.scopus.com/inward/record.uri?eid=2-s2.0-85122836930&doi=10.3366%2fIJHAC.2021.0264&partnerID=40&md5=3ba0313bc8ba227fa089312c3fb6436f","Best practices; Computational methods; Digital humanities; Dissemination; European projects; Horizon 2020; Interdisciplinarity; International cooperation; Interoperability; Research data management; Research infrastructure; Standards; Training","English",Article,Scopus
"Kirillova N.B.","New concepts of media science in the sociocultural system of the information civilization [Новые концепты медианауки в социокультурной системе информационной цивилизации]",2021,"Perspektivy Nauki i Obrazovania",,"10.32744/pse.2021.6.1","https://www.scopus.com/inward/record.uri?eid=2-s2.0-85122814451&doi=10.32744%2fpse.2021.6.1&partnerID=40&md5=89b9efeaf4dcaa154a5e681ad54f63c6","Digital revolution; Globalization; Information civilization; Media culture; Media education; Media science; Socio-cultural space","English",Article,Scopus
"Vitale V., de Soto P., Simon R., Barker E., Isaksen L., Kahn R.","PELAGIOS - CONNECTING HISTORIES OF PLACE. PART I: METHODS AND TOOLS",2021,"International Journal of Humanities and Arts Computing",2,"10.3366/IJHAC.2021.0260","https://www.scopus.com/inward/record.uri?eid=2-s2.0-85122813462&doi=10.3366%2fIJHAC.2021.0260&partnerID=40&md5=a9e673080482b194c41ebbecb3e4147f","Gazetteers; Linked open data; Mapping; Pelagios; Recogito; Semantic annotation; Social computing; Spatial humanities","English",Article,Scopus
"Marchuk A., Troshkov S., Krayneva I.","Long-term Electronic Archives: Modernization and Integration",2021,"CEUR Workshop Proceedings",,,"https://www.scopus.com/inward/record.uri?eid=2-s2.0-85122699144&partnerID=40&md5=88ee6b96f185abf3365aabde0434d810","Drupal; euroCRIS; High-quality information; Integration of electronic resources; Interdisciplinarity; Open archives; Open archives initiative; Proprietary software; Semantic Web","English",Conference Paper,Scopus
"Kuhar K., Košćak S., Renhart E.","THE CONTENT OF THE GLAGOLITIC MISSAL OF COUNT NOVAK IN THE DIGITAL ENVIROMENT [SADRŽAJ GLAGOLJSKOG MISALA KNEZA NOVAKA U DIGITALNOM OKRUŽJU]",2021,"Crkva u Svijetu",,"10.34075/cs.56.4.4","https://www.scopus.com/inward/record.uri?eid=2-s2.0-85122637906&doi=10.34075%2fcs.56.4.4&partnerID=40&md5=4f4744e77d8de3085d01b38d00c25cc5","Church Slavonic language; Croatian glagolitic missals; Digital humanities; Liturgy; Roman-rite missal; TEI","Bosnian",Article,Scopus
"Lawlor B.","An overview of the 2021 NISO Plus conference: Global connections and global conversations",2021,"Information Services and Use",,"10.3233/ISU-210120","https://www.scopus.com/inward/record.uri?eid=2-s2.0-85122591213&doi=10.3233%2fISU-210120&partnerID=40&md5=bbd43a4c320a366e491376ae6a4499ef","Analytics; Artificial intelligence; COUNTER; CRediT taxonomy; Digital humanities; Digital preservation; Discovery services; FAIR data; Fake news; Historical bias; Indigenous knowledge; Information discovery; Information sharing; Knowledgebases; Libraries; Linked data; Machine learning; Metadata; Metrics; Miles conrad lecture; Misinformation; Monopoly; NISO; Open access; Preprint servers; Privacy law; Scholarly communication; Standards; Surveillance capitalism; Tenzing","English",Conference Paper,Scopus
"Colonnese F., Kastrinos N.W.","Coreading Middlemarch in Pandemic Times Using Digital Humanities to Build Community at a Distance",2021,"George Eliot-George Henry Lewes Studies",,"10.5325/GEORELIOGHLSTUD.73.2.0078","https://www.scopus.com/inward/record.uri?eid=2-s2.0-85122580165&doi=10.5325%2fGEORELIOGHLSTUD.73.2.0078&partnerID=40&md5=ec6036569fde7a3e1e0c94248f1fda48","Collaboration; Coreading; Crowd sourcing; Digital humanities; Middlemarch","English",Article,Scopus
"Swati, Mladenić D., Erjavec T.","EveOut: An Event-centric News Dataset to Analyze an Outlet's Event Selection Patterns",2021,"Informatica (Slovenia)",,"10.31449/inf.v45i7.3410","https://www.scopus.com/inward/record.uri?eid=2-s2.0-85122566164&doi=10.31449%2finf.v45i7.3410&partnerID=40&md5=6af72a7d09feec7daed6d4a9998b0bc2","Dataset; Digital humanities; Event selection bias; Gatekeeping bias; News coverage; News event analysis; Outlet prediction","English",Article,Scopus
"Zavaleta J.C., Alva R.Y., Vargas S.V., Medina E.F., Somoza Y.P., Andrade-Arenas L.","Relationship between Stress and Academic Performance: An Analysis in Virtual Mode",2021,"International Journal of Advanced Computer Science and Applications",,"10.14569/IJACSA.2021.01212100","https://www.scopus.com/inward/record.uri?eid=2-s2.0-85122562703&doi=10.14569%2fIJACSA.2021.01212100&partnerID=40&md5=ef64834066c68318b82dc3c274cb8418","Academic performance; anxiety; stress; teachinglearning; virtual mode","English",Article,Scopus
"Maslova I., Krapotkina I., Burdina G.","Methods of Working with Local Digital Resources on History: Foreign Experience and Russian Practices",2021,"International Journal of Web-Based Learning and Teaching Technologies",,"10.4018/IJWLTT.293279","https://www.scopus.com/inward/record.uri?eid=2-s2.0-85122382322&doi=10.4018%2fIJWLTT.293279&partnerID=40&md5=cd51dedc9af0c73bab612ca58ee8d9b7","Digital history; Digital knowledge space; Digital reality; Digitalization; Digitalization of the humanities","English",Article,Scopus
"Agafonova K., Bekisheva K., Drabenia O., Petrova A., Ivanova K.","How Do People Read Science Fiction and Why is it Popular: Common Tendencies and Comparative Analysis",2021,"CEUR Workshop Proceedings",,,"https://www.scopus.com/inward/record.uri?eid=2-s2.0-85122295152&partnerID=40&md5=d1f4485823f1e6549cd657fd64d5deed","Comparative analysis; Data mining; Digital humanities; Latent; Topic modelling","English",Conference Paper,Scopus
"Griffin G.","The ‘Work-Work Balance’ in higher education: between over-work, falling short and the pleasures of multiplicity",2021,"Studies in Higher Education",1,"10.1080/03075079.2021.2020750","https://www.scopus.com/inward/record.uri?eid=2-s2.0-85122262676&doi=10.1080%2f03075079.2021.2020750&partnerID=40&md5=06b4224314b2d0d473e2bd367f58f10e","conflicting job demands; digital humanities; mosaic work portfolio; projectification; Work–work balance","English",Article,Scopus
"Vysotskaya I.V.","Interuniversity scientific seminar “Transient phenomena in language and speech,” in memoriam of Professor Vera Vassilyevna Babaytseva (Kolomna, February 10, 2021) [Межвузовский научный семинар «Переходные явления в языке и речи» памяти профессора В. В. Бабайцевой (Коломна, 10 февраля 2021 г.)]",2021,"Sibirskii Filologicheskii Zhurnal",,"10.17223/18137083/76/25","https://www.scopus.com/inward/record.uri?eid=2-s2.0-85122181255&doi=10.17223%2f18137083%2f76%2f25&partnerID=40&md5=3104d3e08678709f9c6fe0eefe8d12b2","Function; Semantics; Syntactic structure; Syntactics; Syntax; V. V. Babaytseva","Russian",Review,Scopus
"Cooper A.","Collaborative Film Language Analysis in the Networked Information Era",2021,"Italianist",,"10.1080/02614340.2021.1992098","https://www.scopus.com/inward/record.uri?eid=2-s2.0-85122159744&doi=10.1080%2f02614340.2021.1992098&partnerID=40&md5=191021db3ac9f39b7afae01fecc335aa","AVinDH; Cinema; Digital Humanities; Italian; Kinolab","English",Article,Scopus
"Ventimiglia A.","Open Source Religion: Spiritual Software and the Production and Ownership of Religious Data (1955-2010)",2021,"Information and Culture",,"10.7560/IC56303","https://www.scopus.com/inward/record.uri?eid=2-s2.0-85122123178&doi=10.7560%2fIC56303&partnerID=40&md5=264ae96f8949e1490b170d3980b3a131","Bible software; Computer history; Copyright; Data standards; Religious authorship","English",Article,Scopus
"Alvarado R.C., Barriente A.I., Bigelow A.M.","Popol Wujs: Culture, Complexity, and the Encoding of Maya Cosmovisión",2021,"Ethnohistory",,"10.1215/00141801-9157219","https://www.scopus.com/inward/record.uri?eid=2-s2.0-85122066990&doi=10.1215%2f00141801-9157219&partnerID=40&md5=3c78700098ea5b76ad0c8b46981c75de","Digital humanities; Mayan literature; Popol Wuj; Textual encoding","English",Article,Scopus
"Körner K., Turba A.K.","Der Blonde Eckbert - A Serious Game Interpretation of the Eponymous Romantic Fairy Tale",2021,"Lecture Notes in Computer Science (including subseries Lecture Notes in Artificial Intelligence and Lecture Notes in Bioinformatics)",,"10.1007/978-3-030-92182-8_7","https://www.scopus.com/inward/record.uri?eid=2-s2.0-85121931454&doi=10.1007%2f978-3-030-92182-8_7&partnerID=40&md5=c6514f146b4980e0f849eda40ec9e26b","Digital humanities; Digital literary; Serious games","English",Conference Paper,Scopus
"Takahashi S., Yamaguchi K., Watanabe A.","A Novel Approach to Analyze Fashion Digital Library from Humanities",2021,"Lecture Notes in Computer Science (including subseries Lecture Notes in Artificial Intelligence and Lecture Notes in Bioinformatics)",,"10.1007/978-3-030-91669-5_15","https://www.scopus.com/inward/record.uri?eid=2-s2.0-85121927743&doi=10.1007%2f978-3-030-91669-5_15&partnerID=40&md5=eb7570a7906668eb9416bd4e20dba58a","Deep learning; Digital fashion archive; Fashion trend; Image processing; Machine learning","English",Conference Paper,Scopus
"Sezen T.I., Sezen D.","A Pilot Study on Analyzing Critical Retellings Using Digital Humanities Tools",2021,"Lecture Notes in Computer Science (including subseries Lecture Notes in Artificial Intelligence and Lecture Notes in Bioinformatics)",,"10.1007/978-3-030-92300-6_52","https://www.scopus.com/inward/record.uri?eid=2-s2.0-85121918726&doi=10.1007%2f978-3-030-92300-6_52&partnerID=40&md5=0b43984665f1c783e71ed4d9f798c3a7","Digital humanities; Game narrative; Retelling; Video essay","English",Conference Paper,Scopus
"Duan Y., Jatowt A., Yoshikawa M., Liu X., Matono A.","Diachronic Linguistic Periodization of Temporal Document Collections for Discovering Evolutionary Word Semantics",2021,"Lecture Notes in Computer Science (including subseries Lecture Notes in Artificial Intelligence and Lecture Notes in Bioinformatics)",,"10.1007/978-3-030-91669-5_1","https://www.scopus.com/inward/record.uri?eid=2-s2.0-85121915275&doi=10.1007%2f978-3-030-91669-5_1&partnerID=40&md5=8d3bb51934e8ff5a627806c054a5b3cc","Dynamic word embedding; Knowledge discovery in digital history; Temporal document segmentation","English",Conference Paper,Scopus
[No author name available],"23rd International Conference on Asia-Pacific Digital Libraries, ICADL 2021",2021,"Lecture Notes in Computer Science (including subseries Lecture Notes in Artificial Intelligence and Lecture Notes in Bioinformatics)",,,"https://www.scopus.com/inward/record.uri?eid=2-s2.0-85121911749&partnerID=40&md5=66946404a9ddc057c1ed6a8583f72dd2",,"English",Conference Review,Scopus
"Gergatsoulis M., Papaioannou G., Kalogeros E., Mpismpikopoulos I., Tsiouprou K., Carter R.","Modelling Archaeological Buildings Using CIDOC-CRM and Its Extensions: The Case of Fuwairit, Qatar",2021,"Lecture Notes in Computer Science (including subseries Lecture Notes in Artificial Intelligence and Lecture Notes in Bioinformatics)",,"10.1007/978-3-030-91669-5_28","https://www.scopus.com/inward/record.uri?eid=2-s2.0-85121903430&doi=10.1007%2f978-3-030-91669-5_28&partnerID=40&md5=e35bad42ccea2b2bdc97b58a34c29aa9","Archaeology; Archaeology of buildings; CIDOC CRM; CRMarchaeo; CRMba; Digital humanities; Ontologies","English",Conference Paper,Scopus
"Röntsch M.A.","‘The echo chambers of cyberspace’: the meaning and consequences of reconsidering the digital Michael Mosoeu Moerane Critical Edition as an archive",2021,"Journal of the Musical Arts in Africa",,"10.2989/18121004.2021.2013022","https://www.scopus.com/inward/record.uri?eid=2-s2.0-85121849050&doi=10.2989%2f18121004.2021.2013022&partnerID=40&md5=488e40756c53f7a9b1d0b3a06d71b077",,"English",Article,Scopus
