Authors,Title,Year,Source title,Cited by,DOI,Link,Author Keywords,Language of Original Document,Document Type,Source
"Kotze H., Janssen B., Koolen C., van der Plas L., van Egdom G.-W.","Norms, affect and evaluation in the reception of literary translations in multilingual online reading communities Deriving cognitive-evaluative templates from big data",2021,"Translation, Cognition and Behavior",,"10.1075/tcb.00060.kot","https://www.scopus.com/inward/record.uri?eid=2-s2.0-85127359627&doi=10.1075%2ftcb.00060.kot&partnerID=40&md5=fa5b3f2984d3998d88fd402f9d76c814","Affect; Big data; Computational analysis; Digital humanities; Translation norms; Translation reception","English",Article,Scopus
"Oberbichler S., Gallner-Holzmann, Hug T.","Generous and inviting interfaces revisited: Examples of designing visual structures for digital archives",2021,"Information Design Journal",,"10.1075/idj.20028.obe","https://www.scopus.com/inward/record.uri?eid=2-s2.0-85124603903&doi=10.1075%2fidj.20028.obe&partnerID=40&md5=ee0a4222e9aff72162192cbd94efc1cc","Argumentation mapping; Cultural collections; Didactical design; Digital humanities; Information visualization; Interface design","English",Article,Scopus
"Feng L., Underwood T.","The Core Issues and Latest Progress of Current Digital Humanities Research: An Interview with Ted Underwood [当下数字人文研究的核心问题与最新进展: 泰德•安德伍德访谈录]",2021,"Foreign Literature Studies",,,"https://www.scopus.com/inward/record.uri?eid=2-s2.0-85122319795&partnerID=40&md5=673feede6f3526e872603e6fdedb6f7d","Digital analysis; Digital humanities; Machine learning; Statistical model","English",Article,Scopus
"Makhachashvili R., Bakhtina A., Semenist I., Prihodko G., Prykhodchenko O.","Emoji explication in digital communication: Logical-phenomenological experiment",2021,"ACM International Conference Proceeding Series",1,"10.1145/3526242.3526259","https://www.scopus.com/inward/record.uri?eid=2-s2.0-85128665747&doi=10.1145%2f3526242.3526259&partnerID=40&md5=91cca61a187640412613f7118bcb4d87","digital communication; digital humanities; emoji; G. Frege's semantic triangle; polylaterality; qualia; structure; syllogism","English",Conference Paper,Scopus
"Chatzipanagiotou M., Machotka E., Pavlopoulos J.","Automated recognition of geographical named entities in titles of Ukiyo-e prints",2021,"ACM International Conference Proceeding Series",1,"10.1145/3526242.3526254","https://www.scopus.com/inward/record.uri?eid=2-s2.0-85128637891&doi=10.1145%2f3526242.3526254&partnerID=40&md5=41454d5a2f46489ee57758601933c8a2","art history; named entity recognition; natural language processing; Ukiyo-e prints","English",Conference Paper,Scopus
"Buinytska O., Varchenko-Trotsenko L., Terletska T., Tiutiunnyk A.","Utilization of E-learning system for innovative methods implementation in humanities pedagogy",2021,"ACM International Conference Proceeding Series",2,"10.1145/3526242.3526262","https://www.scopus.com/inward/record.uri?eid=2-s2.0-85128630987&doi=10.1145%2f3526242.3526262&partnerID=40&md5=a70d2858c4d3752b61ab462fb99bd831","Collaboration; Digital humanities; E-learning system; Fipped classroom; Innovative methods of teaching; Moodle; Project based learning","English",Conference Paper,Scopus
"Opryshko T., Nazarovets S.","Case Study: Citizen Science in Digital Humanities context",2021,"ACM International Conference Proceeding Series",1,"10.1145/3526242.3526246","https://www.scopus.com/inward/record.uri?eid=2-s2.0-85128619152&doi=10.1145%2f3526242.3526246&partnerID=40&md5=0e4123018664868ce1f6cd067d76d634","Citizen humanities; Citizen science; crowdsourcing; Digital humanities; gamification","English",Conference Paper,Scopus
[No author name available],"Proceedings of Digital Humanities Workshop, DHW 2021",2021,"ACM International Conference Proceeding Series",,,"https://www.scopus.com/inward/record.uri?eid=2-s2.0-85128596360&partnerID=40&md5=caca11c40cfe912a0134959f4fb65bc0",,"English",Conference Review,Scopus
"Semerikov S.O., Mintii I.S., Makhachashvili R.K.","Digital humanities event horizon",2021,"ACM International Conference Proceeding Series",,"10.1145/3526242.3526243","https://www.scopus.com/inward/record.uri?eid=2-s2.0-85128589995&doi=10.1145%2f3526242.3526243&partnerID=40&md5=6c49b630cffb69cac7a4ff35839ae363","DHW; Digital Humanities Workshop","English",Conference Paper,Scopus
"Darmon A.N.M., Bazzi M., Howison S.D., Porter M.A.","Pull out all the stops: Textual analysis via punctuation sequences",2021,"European Journal of Applied Mathematics",2,"10.1017/S0956792520000157","https://www.scopus.com/inward/record.uri?eid=2-s2.0-85094132886&doi=10.1017%2fS0956792520000157&partnerID=40&md5=9db9d7b7aaed77ecb03423ac2db1bd56","categorical time series; computational linguistics; computational methods; digital humanities; Markov processes; mathematical modelling; natural language processing; Stylometry","English",Article,Scopus
"Schouten S., De Boer V., Petram L., Van Erp M.","The Wind in Our Sails: Developing a Reusable and Maintainable Dutch Maritime History Knowledge Graph",2021,"K-CAP 2021 - Proceedings of the 11th Knowledge Capture Conference",,"10.1145/3460210.3493548","https://www.scopus.com/inward/record.uri?eid=2-s2.0-85120915872&doi=10.1145%2f3460210.3493548&partnerID=40&md5=fd10a53834e0eba7e9b42f25461fc5a2","digital humanities; knowledge graph; maritime history","English",Conference Paper,Scopus
"Moretti F.","Quantitative Criticism as Project and Issue [La critica quantitativa come progetto e come problema]",2021,"Intersezioni",,"10.1404/102239","https://www.scopus.com/inward/record.uri?eid=2-s2.0-85130714344&doi=10.1404%2f102239&partnerID=40&md5=d8bb56d17d77ca04976fe2ffb7af1f1e","Digital humanities; Quantitative literary history","Italian",Article,Scopus
"Pinotti A.","Art History in the Mirror of Visual Studies and Digital Humanities [La storia dell’arte nello specchio dei Visual Studies e delle Digital Humanities]",2021,"Intersezioni",,"10.1404/102237","https://www.scopus.com/inward/record.uri?eid=2-s2.0-85130694129&doi=10.1404%2f102237&partnerID=40&md5=97d33b1b029f3db6bfee0ea4577848c8","Digital Art History; Iconic Turn; Image Science; Neuroarthistory; Visual Culture Studies","Italian",Article,Scopus
"Ros R.","Conceptualizing an Outside World The Case of “Foreign” in Dutch Newspapers 1815-1914",2021,"Contributions to the History of Concepts",,"10.3167/choc.2021.160203","https://www.scopus.com/inward/record.uri?eid=2-s2.0-85130116702&doi=10.3167%2fchoc.2021.160203&partnerID=40&md5=6e67207727343db180ff11be7bd2ea03","conceptual history; digital humanities; globalization; nationalism; spatial concepts; text mining","English",Article,Scopus
"Youngmin K.","Transductive Convergence of Digital Humanities/Trans Media Art/World Literature",2021,"Forum for World Literature Studies",,,"https://www.scopus.com/inward/record.uri?eid=2-s2.0-85128675362&partnerID=40&md5=d680a95d981cf8a456080bb3d7784b38","convergence; ethics; feedback loops; Gilbert Simondon; individuation; pre-individual; transduction; world literature","English",Article,Scopus
"Marchevska E., Defrin C.","‘Third nature’: Embodiment of borders and thinking beyond – surviving despite capitalism",2021,"Journal of Dance and Somatic Practices",,"10.1386/jdsp_00037_1","https://www.scopus.com/inward/record.uri?eid=2-s2.0-85127383261&doi=10.1386%2fjdsp_00037_1&partnerID=40&md5=5889b964e0cd0b71f917fcc2f0892f5e","Authentic Movement; borders; co-creation; eco-humanities; pluriverse; somatic practice","English",Article,Scopus
"Arthur P.L., Hearn L., Montgomery L., Craig H., Arbuckle A., Siemens R.","Open scholarship in Australia: A review of needs, barriers, and opportunities",2021,"Digital Scholarship in the Humanities",,"10.1093/llc/fqaa063","https://www.scopus.com/inward/record.uri?eid=2-s2.0-85126700613&doi=10.1093%2fllc%2ffqaa063&partnerID=40&md5=fd77c0c030a1b14bb2538454e5ca2c44",,"English",Review,Scopus
[No author name available],"Erratum: Polysemy, synonymy, and metaphor: The use of the Historical Thesaurus of English in translation studies (Digital Scholarship in the Humanities DOI: 10.1093/llc/fqab008)",2021,"Digital Scholarship in the Humanities",,"10.1093/llc/fqab044","https://www.scopus.com/inward/record.uri?eid=2-s2.0-85126696889&doi=10.1093%2fllc%2ffqab044&partnerID=40&md5=85295c324e218a84acafc160f013ff33",,"English",Erratum,Scopus
"Cuijuan Xia, Wang L., Liu W.","Shanghai memory as a digital humanities platform to rebuild the history of the city",2021,"Digital Scholarship in the Humanities",,"10.1093/llc/fqab023","https://www.scopus.com/inward/record.uri?eid=2-s2.0-85126689751&doi=10.1093%2fllc%2ffqab023&partnerID=40&md5=6c65511c6149a90e5ee5d5839844e209",,"English",Article,Scopus
"Daugavietis J.","Motivation to engage in crowdsourcing: Towards the synthetic psychological-sociological model",2021,"Digital Scholarship in the Humanities",,"10.1093/llc/fqab024","https://www.scopus.com/inward/record.uri?eid=2-s2.0-85126661079&doi=10.1093%2fllc%2ffqab024&partnerID=40&md5=0d1f03efcde64729e8f8eaa730a0c64e",,"English",Article,Scopus
"Locke J.L., Wright B.","History Can Be Open Source: Democratic Dreams and the Rise of Digital History",2021,"American Historical Review",,"10.1093/ahr/rhab534","https://www.scopus.com/inward/record.uri?eid=2-s2.0-85125094023&doi=10.1093%2fahr%2frhab534&partnerID=40&md5=eb947eb9d05497123668987d90af9dbd","Democracy; Digital History; Digital Humanities; Historiography; Open Access; Open Educational Resources; Open Source","English",Article,Scopus
"Manzano M.Á., Carrasco D.M.","Philology and digital humanities: a toponymic repertoire from the Maghreb [Filología y humanidades digitales: un repertorio toponímico del Magreb]",2021,"Estudios Filologicos",,"10.4067/s0071-17132021000200089","https://www.scopus.com/inward/record.uri?eid=2-s2.0-85124479072&doi=10.4067%2fs0071-17132021000200089&partnerID=40&md5=63961297f0f68309a09bca79d0ee066f","Arab-Islamic geography; Cultural geography; Digital humanities; Maghreb; Toponymy","Spanish",Article,Scopus
"Neagu A.","Modernism, Postmodernism and the Nature of the Times: A Conversation with Randall Stevenson",2021,"American, British and Canadian Studies",,"10.2478/abcsj-2021-0020","https://www.scopus.com/inward/record.uri?eid=2-s2.0-85123949482&doi=10.2478%2fabcsj-2021-0020&partnerID=40&md5=eb08251519108b3f70ce1d0821e28db7","Dissociation of sensibility; Epistemic; Historicity; Humanities; Literature; Modernism; Paradigmatic; Post-war sensibility; Postmodernism; Temporality","English",Article,Scopus
"Esipova V.A., Svetlichnaya N.N.","The ProSiberia Platform: The First Year of Operation and Development Prospects [ПЛАТФОРМА PROСИБИРЬ: ПЕРВЫЙ ГОД РАБОТЫ И ПЕРСПЕКТИВЫ РАЗВИТИЯ]",2021,"Tekst, Kniga, Knigoizdaniye",,"10.17223/23062061/27/8","https://www.scopus.com/inward/record.uri?eid=2-s2.0-85123535457&doi=10.17223%2f23062061%2f27%2f8&partnerID=40&md5=5e0b7886988c2ab062f37bdbebe2e589","Digital humanities; Digital platform; Philology; Research infrastructure; Siberia","Russian",Article,Scopus
"Longhi J.","Mapping information and identifying disinformation based on digital humanities methods: From accuracy to plasticity",2021,"Digital Scholarship in the Humanities",1,"10.1093/llc/fqab005","https://www.scopus.com/inward/record.uri?eid=2-s2.0-85123520020&doi=10.1093%2fllc%2ffqab005&partnerID=40&md5=61457b3a3e19158d07f805b59271c60e",,"English",Article,Scopus
"Wang Y., Liu X.-Y., Liu X.-R., Cui X., Meng H.-R.","Development status and trend of digital holography technology for extraterrestrial life detection [地外生命探测数字全息技术发展现状及趋势]",2021,"Guangxue Jingmi Gongcheng/Optics and Precision Engineering",,"10.37188/OPE.20212912.2774","https://www.scopus.com/inward/record.uri?eid=2-s2.0-85123447291&doi=10.37188%2fOPE.20212912.2774&partnerID=40&md5=bbd42fb791a3561b9c90db5a85999830","Digital holography; Extraterrestrial life detection; Marine in-situ detection; Microbial detection","Chinese",Article,Scopus
"Quintanilla S.F., Álvarez M.E.","La intersección entre estudios hispánicos y humanidades digitales: El aporte interdisciplinario de Borderlands Archives Cartography",2021,"Hispania",,"10.1353/HPN.2021.0129","https://www.scopus.com/inward/record.uri?eid=2-s2.0-85123443708&doi=10.1353%2fHPN.2021.0129&partnerID=40&md5=6439e3ba3c63c4d9122562761284f510","Archive; Borderlands Archives Cartography; Digital Humanities; Geopolitics; Hispanic Studies","Spanish",Article,Scopus
"Phillips N.","Digital Cities, Digital Crimes: Mapping Spanish Detective Fiction",2021,"Hispania",,"10.1353/HPN.2021.0132","https://www.scopus.com/inward/record.uri?eid=2-s2.0-85123442407&doi=10.1353%2fHPN.2021.0132&partnerID=40&md5=7a6c4ecadebf751a9d6db471fa30ef55","Cultural studies; Digital Humanities; Mapping; Spain; Spanish literature","English",Article,Scopus
"Allés-Torrent S., Myers M.J., Ortega É.","New Dialogues in Spanish and Portuguese Studies: Pedagogical and Theoretical Perspectives from the Digital Humanities",2021,"Hispania",,"10.1353/HPN.2021.0124","https://www.scopus.com/inward/record.uri?eid=2-s2.0-85123439121&doi=10.1353%2fHPN.2021.0124&partnerID=40&md5=d79ba073d4e6e98c9c471a00a999e322",,"English",Article,Scopus
"Bender R.M.","From Snaps to Maps: Using Literature, Mobile Applications, and Mapping Software to Design an Engaging L2 Curriculum",2021,"Hispania",,"10.1353/HPN.2021.0126","https://www.scopus.com/inward/record.uri?eid=2-s2.0-85123428456&doi=10.1353%2fHPN.2021.0126&partnerID=40&md5=4d823d5b8f5ff5b9baac288f3b44ec5e","Apps; Digital Humanities; Literature; Maps; Narrative; Pedagogy; Second-language acquisition","English",Article,Scopus
"Arriaga E.","Culturas digitales afrolatinxs y afrolatinoamericanas: De la recuperación histórica a la humanización digital",2021,"Hispania",,"10.1353/HPN.2021.0125","https://www.scopus.com/inward/record.uri?eid=2-s2.0-85123415879&doi=10.1353%2fHPN.2021.0125&partnerID=40&md5=65f4c1949dcf3d1bcb603a8253c3921b","Afrolatinxs; Americas; Digital Humanities; Infrastructure; Innovation","Spanish",Article,Scopus
"Rocha de Luna R., García A.Z.","Humanidades públicas digitales: Construyendo una comunidad digital solidaria en Redes, migrantes sin fronteras",2021,"Hispania",,"10.1353/HPN.2021.0121","https://www.scopus.com/inward/record.uri?eid=2-s2.0-85123408009&doi=10.1353%2fHPN.2021.0121&partnerID=40&md5=ff973b6898ae13c7840b24fe31fb0b78","Digital Humanities; Digital Public Humanities; Digital Rhetoric; Migration; Postcolonial Digital Humanities; Public Humanities; Solidary digital community","Spanish",Article,Scopus
"Isasi J., Castro A.R.","¿Sin equivalencia? Una reflexión sobre la traducción al español de recursos educativos abiertos",2021,"Hispania",,"10.1353/HPN.2021.0130","https://www.scopus.com/inward/record.uri?eid=2-s2.0-85123406550&doi=10.1353%2fHPN.2021.0130&partnerID=40&md5=2443f5f96b34de72b0bfec49db442363","Digital Humanities; Digital methods; Digital Pedagogy; Multilingualism; Programming Historian; Translation","Spanish",Article,Scopus
"Kuder E.","Digital Coursework for Language for Specific Purposes Courses",2021,"Hispania",,"10.1353/HPN.2021.0131","https://www.scopus.com/inward/record.uri?eid=2-s2.0-85123401485&doi=10.1353%2fHPN.2021.0131&partnerID=40&md5=628333b0f072acc24fc8210daceabe47","Community engagement; Curricular design; Digital Humanities; Language for specific purposes; Open educational resources; Open pedagogy","English",Article,Scopus
"Benedict N.","The Risks and Rewards of Implementing Digital Humanities Methodologies in Modern Language Graduate Research",2021,"Hispania",,"10.1353/HPN.2021.0127","https://www.scopus.com/inward/record.uri?eid=2-s2.0-85123395550&doi=10.1353%2fHPN.2021.0127&partnerID=40&md5=d30c3c832e36d1f0d6aa9cf6b27d6a89","Digital Humanities; Funding; Graduate research; Modern languages; Training","English",Article,Scopus
"Klopotan A.","Comparative Research of the Ways Professional Readers and Unprofessional Readers-Bloggers Write about Literature [Usporedba načina pisanja o književnosti književnih kritičara i neprofesionalnih čitatelja-blogera]",2021,"Sic",,"10.15291/SIC/1.12.LC.8","https://www.scopus.com/inward/record.uri?eid=2-s2.0-85122640035&doi=10.15291%2fSIC%2f1.12.LC.8&partnerID=40&md5=37eea1161802204624b5d5208f7c44df","Book blogs; Digital humanities; Professional readers; Reader reception; Unprofessional readers","Bosnian",Article,Scopus
"Gkadolou E., Prastacos P.","Historical Cartographic Information for Cultural Heritage Applications in a Semantic Framework",2021,"Cartographica",,"10.3138/cart-2021-0002","https://www.scopus.com/inward/record.uri?eid=2-s2.0-85121812894&doi=10.3138%2fcart-2021-0002&partnerID=40&md5=5520787998138c4b78dedad5f08b51ee","Arches; Candia; CIDOC; Cultural; Historical; Map","English",Article,Scopus
"El-Hajj H., Valleriani M.","Cidoc2vec: Extracting information from atomized cidoc-crm humanities knowledge graphs",2021,"Information (Switzerland)",1,"10.3390/info12120503","https://www.scopus.com/inward/record.uri?eid=2-s2.0-85121622793&doi=10.3390%2finfo12120503&partnerID=40&md5=9eb42867014a0a77c18012c592c5bcd0","CIDOC-CRM; Data extraction; Digital humanities; Knowledge graph; Recommender system; Sphaera","English",Article,Scopus
"Vogel S.","""Los Programadores Debieron Pensarse Como Dos Veces"": Exploring the Intersections of Language, Power, and Technology with Bi/Multilingual Students",2021,"ACM Transactions on Computing Education",1,"10.1145/3447379","https://www.scopus.com/inward/record.uri?eid=2-s2.0-85121122263&doi=10.1145%2f3447379&partnerID=40&md5=f905b60b8958d3550c0c55d5fe1c0061","Bilingual students; critical computing education; equity; K-12 education; translanguaging","English",Article,Scopus
"Fletcher S.C., Knobe J., Wheeler G., Woodcock B.A.","Changing use of formal methods in philosophy: late 2000s vs. late 2010s",2021,"Synthese",2,"10.1007/s11229-021-03433-9","https://www.scopus.com/inward/record.uri?eid=2-s2.0-85120348279&doi=10.1007%2fs11229-021-03433-9&partnerID=40&md5=4fc554b605e312ca7fa39b3b27de705b","Digital humanities; Formal methods in philosophy; Logic; Metaphilosophy; Philosophical Studies; Probability","English",Article,Scopus
"Kunkel N.","Understanding, Interpretation, Modeling: Does Digital Literary Studies Need a Digital Hemeneutics? [Verstehen, Interpretation, Modellierung: Benötigt die digitale Literaturwissenschaft eine digitale Hermeneutik?]",2021,"Lili - Zeitschrift fur Literaturwissenschaft und Linguistik",,"10.1007/s41244-021-00233-z","https://www.scopus.com/inward/record.uri?eid=2-s2.0-85120000792&doi=10.1007%2fs41244-021-00233-z&partnerID=40&md5=84901c43617c5fc9ec413b68017adf50","Digital Literary Studies; German Studies; Hermeneutics; Methodology; Mixed Methods","German",Article,Scopus
"Gebert B.","Self-Evidence: Epistemological Provocation and Hermeneutic Style [Selbstverständlichkeit: Epistemologische Provokation und hermeneutischer Stil]",2021,"Lili - Zeitschrift fur Literaturwissenschaft und Linguistik",,"10.1007/s41244-021-00237-9","https://www.scopus.com/inward/record.uri?eid=2-s2.0-85119957766&doi=10.1007%2fs41244-021-00237-9&partnerID=40&md5=51386d6fe344335904b4ec44a8ef3f37","Cultural Studies; Hermeneutics; Literary Theory; Medieval Studies; Style","German",Article,Scopus
"Mukherjee S.","Crab-Rangoons in Kyrat: (Re)Writing South-Asian History in Far Cry 4",2021,"Games and Culture",,"10.1177/15554120211005240","https://www.scopus.com/inward/record.uri?eid=2-s2.0-85119882738&doi=10.1177%2f15554120211005240&partnerID=40&md5=fdfd199643c5fd814afc48e6ff08be31","border-thinking; minor history; postcolonial; South Asia; subaltern pasts","English",Article,Scopus
"Geier A.","Methodological Debates as Disciplinary Debates: Open Questions on the Occasion of a Call for Papers for a Positioning of German Studies [Methodendebatten als Fachdebatten: Offene Fragen zu einer Standortbestimmung der Germanistik anlässlich eines Call for Papers]",2021,"Lili - Zeitschrift fur Literaturwissenschaft und Linguistik",,"10.1007/s41244-021-00229-9","https://www.scopus.com/inward/record.uri?eid=2-s2.0-85119656728&doi=10.1007%2fs41244-021-00229-9&partnerID=40&md5=9bc6d7f62bd7d02085248cbcdfd6ed7b","Crisis Narratives; Cultural Studies; Digital/Digitality; German Studies; Hermeneutics; Literary Studies; Methodological Pluralism; Reading; Relevance","German",Article,Scopus
"Nakissa A.","Cognitive and quantitative approaches to Islamic studies: Integrating psychological, socioeconomic, and digital-cultural statistics",2021,"Religion Compass",1,"10.1111/rec3.12424","https://www.scopus.com/inward/record.uri?eid=2-s2.0-85119021837&doi=10.1111%2frec3.12424&partnerID=40&md5=f228a3d17714fcefc9d73f78b734e23c",,"English",Article,Scopus
"Ng R.","Anti-Asian Sentiments during the COVID-19 Pandemic across 20 Countries: Analysis of a 12-Billion-Word News Media Database",2021,"Journal of Medical Internet Research",7,"10.2196/28305","https://www.scopus.com/inward/record.uri?eid=2-s2.0-85118681046&doi=10.2196%2f28305&partnerID=40&md5=3d55710d817fd8b83e46963e8584e7e3","Anti-Asian sentiments; COVID-19; Culture; Digital humanities; Psychomics; Quantitative social science; Racism; Text as data; Xenophobia","English",Article,Scopus
"González A.D.U.","An urban heritage assessment with Panoramio, a Big-Data source. A study of downtown Bogotá [Uma proposta de valorização do patrimônio urbano à luz do Panoramio, uma fonte de Big-Data. O caso do centro de Bogotá] [Una propuesta de valoración de patrimonio urbano a la luz de Panoramio, una fuente Big-Data. El caso del centro de Bogotá]",2021,"Territorios",,"10.12804/revistas.urosario.edu.co/territorios/a.9927","https://www.scopus.com/inward/record.uri?eid=2-s2.0-85118645387&doi=10.12804%2frevistas.urosario.edu.co%2fterritorios%2fa.9927&partnerID=40&md5=f7b1db9d5b8fd7458bbf503d7e266872","Digital humanities; Downtown Bogotá; Panoramio; Urban heritage; Urban landscape","Spanish",Article,Scopus
"Decheva P.","Trace the untraceable: Online image search tools for researching late antique art",2021,"Heritage",,"10.3390/heritage4040225","https://www.scopus.com/inward/record.uri?eid=2-s2.0-85118497943&doi=10.3390%2fheritage4040225&partnerID=40&md5=1351fc02ea9cfe20134cca2a4e201fd2","Byzantine art; Image libraries; Late antique art; Online museum collections","English",Article,Scopus
"Miquel-Ribé M., Laniado D.","The Wikipedia Diversity Observatory: helping communities to bridge content gaps through interactive interfaces",2021,"Journal of Internet Services and Applications",2,"10.1186/s13174-021-00141-y","https://www.scopus.com/inward/record.uri?eid=2-s2.0-85118346181&doi=10.1186%2fs13174-021-00141-y&partnerID=40&md5=2586bd3e7feba3f87231e9b80035f4ed","Culture gap; Data visualization; Digital humanities; Diversity; Gender gap; Online collaboration; Wikipedia","English",Article,Scopus
"Kosciejew M.","The crystal goblet revisited: Approaching text as documentation within the digital humanities",2021,"Digital Scholarship in the Humanities",1,"10.1093/llc/fqab006","https://www.scopus.com/inward/record.uri?eid=2-s2.0-85117548316&doi=10.1093%2fllc%2ffqab006&partnerID=40&md5=747556c1ecfecfc8a3a65653b4eed8d6",,"English",Article,Scopus
"Čyras V., Lachmayer F.","Legal visualisation in the digital age: From textual law towards human digitalities",2021,"Jusletter IT",2,"10.38023/1713cfa8-d7f5-49e8-a302-053bec474204","https://www.scopus.com/inward/record.uri?eid=2-s2.0-85111548207&doi=10.38023%2f1713cfa8-d7f5-49e8-a302-053bec474204&partnerID=40&md5=5bc59ae967048416c1aae1a02bea7d59",,"English",Article,Scopus
"Su Q., Liu P., Wei W., Zhu S., Huang C.-R.","Occupational gender segregation and gendered language in a language without gender: trends, variations, implications for social development in China",2021,"Humanities and Social Sciences Communications",1,"10.1057/s41599-021-00799-6","https://www.scopus.com/inward/record.uri?eid=2-s2.0-85107418826&doi=10.1057%2fs41599-021-00799-6&partnerID=40&md5=bb5d57e76a4f501c1a1bfd328870f866",,"English",Article,Scopus
"Pflüger H.","A language to analyze, describe, and explore collections of visual art",2021,"Visual Computing for Industry, Biomedicine, and Art",1,"10.1186/s42492-021-00071-3","https://www.scopus.com/inward/record.uri?eid=2-s2.0-85102033429&doi=10.1186%2fs42492-021-00071-3&partnerID=40&md5=3134979377ff8e950207b7433422454b","Collections of visual art; Digital humanities; Personalized digital libraries; Semantics; Visual computing","English",Article,Scopus
"Burgess H.J.","Machine dream anthropocene: On taking a bot to the mla",2021,"Configurations",,"10.1353/con.2021.0003","https://www.scopus.com/inward/record.uri?eid=2-s2.0-85100823090&doi=10.1353%2fcon.2021.0003&partnerID=40&md5=656b920e6ae03579842d9d20a69ddc4c",,"English",Article,Scopus
"Fafalios P., Petrakis K., Samaritakis G., Doerr K., Kritsotaki A., Tzitzikas Y., Doerr M.","FAST CAT: Collaborative data entry and curation for semantic interoperability in digital humanities",2021,"Journal on Computing and Cultural Heritage",3,"10.1145/3461460","https://www.scopus.com/inward/record.uri?eid=2-s2.0-85100623559&doi=10.1145%2f3461460&partnerID=40&md5=ece26082234895b6f11deb90f19203c4","archival research; data curation; Data entry; digital humanities; semantic interoperability","English",Article,Scopus
"Santos D., Bick E., Wlodek M.","Assessing named entities in the ELTeC-por collection [Avaliando entidades mencionadas na colecao ELTeC-por]",2021,"Linguamatica",2,"10.21814/LM.12.2.336","https://www.scopus.com/inward/record.uri?eid=2-s2.0-85100087831&doi=10.21814%2fLM.12.2.336&partnerID=40&md5=1085adb53330a3e9c489f34945d2e11c","Corpus compilation; Digital humanities; Distant reading; Named entity recognition; Portuguese; Portuguese literature","Portuguese",Article,Scopus
