"Hawkins S.","Access and control in digital humanities",2021,"Access and Control in Digital Humanities",,"10.4324/9780429259616","https://www.scopus.com/inward/record.uri?eid=2-s2.0-85108759697&doi=10.4324%2f9780429259616&partnerID=40&md5=1ccd7c879b22a3a548653cc8a8e3934c",,"English",Book,Scopus
"Hawkins S.","Introduction: Access and control in digital humanities",2021,"Access and Control in Digital Humanities",,,"https://www.scopus.com/inward/record.uri?eid=2-s2.0-85108755886&partnerID=40&md5=5f805c1bd8f5009c80531f5c01972095",,"English",Editorial,Scopus
"Nayyer K.P.","Issues and intersections of indigenous knowledge protection and copyright for digital humanities",2021,"Access and Control in Digital Humanities",1,,"https://www.scopus.com/inward/record.uri?eid=2-s2.0-85108751559&partnerID=40&md5=a5be01c7fc4274a952112cd4bb20d7e4",,"English",Book Chapter,Scopus
"Neumann A.T., Arndt T., Köbis L., Meissner R., Martin A., de Lange P., Pengel N., Klamma R., Wollersheim H.-W.","Chatbots as a Tool to Scale Mentoring Processes: Individually Supporting Self-Study in Higher Education",2021,"Frontiers in Artificial Intelligence",5,"10.3389/frai.2021.668220","https://www.scopus.com/inward/record.uri?eid=2-s2.0-85117917152&doi=10.3389%2ffrai.2021.668220&partnerID=40&md5=b36507ea630be7d5bccb7a4379304159","automated feedback; chatbot; mentoring; self-study activities; technology-enhanced learning","English",Article,Scopus
"Brzozowska B., Galuszka P.","Crowdfunding and independence in film and music",2021,"Crowdfunding and Independence in Film and Music",2,"10.4324/9781003150787","https://www.scopus.com/inward/record.uri?eid=2-s2.0-85113125035&doi=10.4324%2f9781003150787&partnerID=40&md5=d09a618ffa595bccbf7773bed8be6473",,"English",Book,Scopus
"Parker L.","Mapping Exile: Khodasevich's ‘European Night’, 1922–1927",2021,"Russian Literature",,"10.1016/j.ruslit.2021.07.007","https://www.scopus.com/inward/record.uri?eid=2-s2.0-85112469891&doi=10.1016%2fj.ruslit.2021.07.007&partnerID=40&md5=3ebb942ccfa6711d2796ec17bb162d2f","Digital Humanities; Exile; Mapping; Vladislav Khodasevich; Émigré","English",Article,Scopus
"Martiniuk J., Thompson K.","Understanding Russia in 3D: A Curricular Experiment in Cultural Identity",2021,"Russian Literature",1,"10.1016/j.ruslit.2021.07.010","https://www.scopus.com/inward/record.uri?eid=2-s2.0-85112458427&doi=10.1016%2fj.ruslit.2021.07.010&partnerID=40&md5=94f6ce8ba098c1325e4ed15eb5ce799a","3D Printing; Cultural Pedagogy; Digital Humanities; Identity; Russian Culture","English",Article,Scopus
"Lvoff B.","Distant Reading in Russian Formalism and Russian Formalism in Distant Reading",2021,"Russian Literature",1,"10.1016/j.ruslit.2021.07.003","https://www.scopus.com/inward/record.uri?eid=2-s2.0-85112419823&doi=10.1016%2fj.ruslit.2021.07.003&partnerID=40&md5=552451e690a935346c03160394880e64","Digital Humanities; Iarkho; Moretti; Russian Formalism; Shklovskii","English",Article,Scopus
"Bozovic M., Chenoweth C., Lassin J., Kirkpatrick T.","Knight Moves: Russifying Quantitative Literary Studies",2021,"Russian Literature",2,"10.1016/j.ruslit.2021.07.006","https://www.scopus.com/inward/record.uri?eid=2-s2.0-85112416885&doi=10.1016%2fj.ruslit.2021.07.006&partnerID=40&md5=af2acdb053f0252507cbaea6a304f520","Quantitative Literary Studies; Russian Formalism; Slavic Review; Topic Modeling","English",Article,Scopus
"Gleissner P.","“Somehow, I Wasn't Drawn into The Editorial Office of Novyi Mir”: Digital Approaches to the Literary Environment of Late Socialist Journals",2021,"Russian Literature",1,"10.1016/j.ruslit.2021.07.008","https://www.scopus.com/inward/record.uri?eid=2-s2.0-85112412626&doi=10.1016%2fj.ruslit.2021.07.008&partnerID=40&md5=83777468f382d9042e558b7fa947e71f","Digital Humanities; Late Socialism; Literary Journals; Russian Formalism","English",Article,Scopus
"Josiowicz A.J.","Digital humanities and reading on Twitter. ""a placebo that heals in times of COVID-19 [Humanidades digitales e leitura no Twitter. ""un placebo sanador en tiempos de COVID-19]",2021,"Estudos Historicos",,"10.1590/S2178-149420210207","https://www.scopus.com/inward/record.uri?eid=2-s2.0-85108197191&doi=10.1590%2fS2178-149420210207&partnerID=40&md5=f6df1fef8c61d63082dab41899f09095","Clarice lispector; Digital humanities; Global south; Jorge luis borges; Reading practices; Social media","Portuguese",Article,Scopus
"Scott-Monkhouse A.R., Tal M., Yelenevskaya M.","International teleconferences in EGAP courses: Preparing students for prospective professional situations",2021,"Language Learning in Higher Education",,"10.1515/cercles-2021-2003","https://www.scopus.com/inward/record.uri?eid=2-s2.0-85108191991&doi=10.1515%2fcercles-2021-2003&partnerID=40&md5=38030b6a7f33a6ea6254bd64bb5e10b6","active learning; cooperative learning; digital technologies; EGAP/ESP courses; presenting in a foreign language; teleconference","English",Article,Scopus
"Rodríguez-Alfonso A.","Intellectual networks and literary field: Babel. Revista de libros [Redes intelectuales y campo literario: Babel. Revista de Libros]",2021,"Literatura y Linguistica",,"10.29344/0717621X.43.2557","https://www.scopus.com/inward/record.uri?eid=2-s2.0-85107871446&doi=10.29344%2f0717621X.43.2557&partnerID=40&md5=341b0938cf0feb91887b8a966ee6a2b9","Digital humanities; Intellectual networks; Literary field; Literary magazines; Shanghai Group","Spanish",Article,Scopus
"Boulay N., Morford A.C., Jacob A., Patel K., O'Donnell K.","Transforming DH Pedagogy",2021,"Digital Studies/ Le Champ Numerique",,"10.5334/JOC.160","https://www.scopus.com/inward/record.uri?eid=2-s2.0-85107644385&doi=10.5334%2fJOC.160&partnerID=40&md5=974470a48d7ba5deff22289b18faefeb","Digital activism; Digital humanities (DH); Digital pedagogy; Social justice; Transgender; Video game technology","English",Review,Scopus
"Marlatt R., Sulzer M.A.","Illuminating the dark side: A typology for preservice ELA teachers engaging in ideologies of digital texts",2021,"E-Learning and Digital Media",,"10.1177/2042753020980119","https://www.scopus.com/inward/record.uri?eid=2-s2.0-85097560052&doi=10.1177%2f2042753020980119&partnerID=40&md5=2a6622cd670350a2bfb0185d0082c0f5","critical media literacy; Digital literacies; digital texts; English language arts; software theory; teacher education","English",Article,Scopus
"Villanueva Baselga S., Perez-Montoro M., Sánchez L.","The use of statistics to define taxonomies of film voices: a practical approach to documentary classification",2021,"Visual Communication",,"10.1177/1470357219850591","https://www.scopus.com/inward/record.uri?eid=2-s2.0-85066844356&doi=10.1177%2f1470357219850591&partnerID=40&md5=91d958a7f60a8b574a4b24756118cc31","card sorting; cluster analysis; documentary film; study of film visual documentary; taxonomies","English",Article,Scopus
"Lindmayr-Brandl A., McDonald G.","Early Printed Music and Material Culture in Central and Western Europe",2021,"Early Printed Music and Material Culture in Central and Western Europe",,"10.4324/9780429342844","https://www.scopus.com/inward/record.uri?eid=2-s2.0-85108864816&doi=10.4324%2f9780429342844&partnerID=40&md5=824a581cafda800cd1e15ced6af0aec2",,"English",Book,Scopus
"Wang X., Zhang R., Wang Z., Li T.","How Does Digital Competence Preserve University Students’ Psychological Well-Being During the Pandemic? An Investigation From Self-Determined Theory",2021,"Frontiers in Psychology",12,"10.3389/fpsyg.2021.652594","https://www.scopus.com/inward/record.uri?eid=2-s2.0-85105487291&doi=10.3389%2ffpsyg.2021.652594&partnerID=40&md5=9630118b81d4f97577c5d7352b602abf","digital competence; pandemic; psychological wellbeing; socioeconomic status; university students","English",Article,Scopus
"Mike K., Hartal G., Hazzan O.","Widening the shrinking pipeline: The case of data science",2021,"IEEE Global Engineering Education Conference, EDUCON",2,"10.1109/EDUCON46332.2021.9453924","https://www.scopus.com/inward/record.uri?eid=2-s2.0-85112474212&doi=10.1109%2fEDUCON46332.2021.9453924&partnerID=40&md5=12380504f80c86356fb43724dc799393","Data science; Data science education; Gender balance; Interdisciplinary of data science","English",Conference Paper,Scopus
"Mukamal A., Moffatt K., Sharren K., Battershill C.","Student labour and major research projects",2021,"Digital Studies/ Le Champ Numerique",,"10.16995/DSCN.375","https://www.scopus.com/inward/record.uri?eid=2-s2.0-85105755116&doi=10.16995%2fDSCN.375&partnerID=40&md5=d61d527a24aa542996668036bbebcbef","Critical digital archive; Digital humanities (DH); Digital pedagogy; Feminist praxis; Project management; Student labour","English",Review,Scopus
"Elizabeth Arones Mayuri M., Rosa Godoy Pereyra Y., De La Cruz J.G.E., Alberto Guerrero Salazar F.","Learning progress in university students associated with disruptive innovation of metacognitive strategies in times of COVID-19",2021,"ACM International Conference Proceeding Series",,"10.1145/3463531.3463548","https://www.scopus.com/inward/record.uri?eid=2-s2.0-85119851489&doi=10.1145%2f3463531.3463548&partnerID=40&md5=229a835e8a8c3da11fe507883b482bbd","information and communication technology; remote teaching; Self-regulation","English",Conference Paper,Scopus
"Artamonov D.S., Tikhonova S.V., Volovikova M.L.","Mythologizing Time in Internet Memes of the COVID-19 Pandemic Period",2021,"Proceedings of the 2021 Communication Strategies in Digital Society Seminar, ComSDS 2021",,"10.1109/ComSDS52473.2021.9422862","https://www.scopus.com/inward/record.uri?eid=2-s2.0-85106041329&doi=10.1109%2fComSDS52473.2021.9422862&partnerID=40&md5=00ad0c93b050cde8d5ca92946be1c5d6","contemporary social myth; digital age mass consciousness; internet meme; media environment; mythmaking; time modes; time mythologization","English",Conference Paper,Scopus
"Lepper M., Widemann B.T.","Technical topologies of texts",2021,"Digital Studies/ Le Champ Numerique",,"10.16995/DSCN.313","https://www.scopus.com/inward/record.uri?eid=2-s2.0-85105436118&doi=10.16995%2fDSCN.313&partnerID=40&md5=87cdf6eb84c8a94b99916236865ab738","Document type; Mathematical modelling; Survey on standards; Text processing","English",Review,Scopus
"Wymer K.C.","Introduction to Digital Humanities: Enhancing Scholarship with the Use of Technology",2021,"Introduction to Digital Humanities: Enhancing Scholarship with the Use of Technology",,"10.4324/9781003149378","https://www.scopus.com/inward/record.uri?eid=2-s2.0-85107931466&doi=10.4324%2f9781003149378&partnerID=40&md5=7df47c3854237d3caa189f66bd23e1f1",,"English",Book,Scopus
"Akça A.","A conceptual model to increase the visibility and usage of cultural heritage objects: The case of UNESCO's Memory of the World list",2021,"Digital Scholarship in the Humanities",,"10.1093/llc/fqz091","https://www.scopus.com/inward/record.uri?eid=2-s2.0-85126788524&doi=10.1093%2fllc%2ffqz091&partnerID=40&md5=0a489e3c0b99249c38b734d4a0d33a0e",,"English",Article,Scopus
[No author name available],"Erratum: Chinua Achebe’s There was a Country and the digital publics of African literature (Digital Scholarship in the Humanities DOI: 10.1093/llc/fqz084)",2021,"Digital Scholarship in the Humanities",,"10.1093/llc/fqaa001","https://www.scopus.com/inward/record.uri?eid=2-s2.0-85126752349&doi=10.1093%2fllc%2ffqaa001&partnerID=40&md5=7a2d30726980698583221dfeade4c8b5",,"English",Erratum,Scopus
"Engerer V.P.","'Attention, attention, exploring minds acknowledge digital structure!' the shift to digital humanities has happened, so what should information scientists do in response?",2021,"Digital Scholarship in the Humanities",1,"10.1093/llc/fqaa008","https://www.scopus.com/inward/record.uri?eid=2-s2.0-85126644066&doi=10.1093%2fllc%2ffqaa008&partnerID=40&md5=23c174754e09be4357274d6f7aaf431f",,"English",Article,Scopus
"Jacobs B.","A transdisciplinary protocol for digital scholarship",2021,"Digital Scholarship in the Humanities",1,"10.1093/llc/fqz087","https://www.scopus.com/inward/record.uri?eid=2-s2.0-85126610541&doi=10.1093%2fllc%2ffqz087&partnerID=40&md5=bcd2d6f41b2f42c6f6a8d75531605b04",,"English",Article,Scopus
"Peters M.A., Jandrić P., Hayes S.","Biodigital Philosophy, Technological Convergence, and Postdigital Knowledge Ecologies",2021,"Postdigital Science and Education",18,"10.1007/s42438-020-00211-7","https://www.scopus.com/inward/record.uri?eid=2-s2.0-85124756895&doi=10.1007%2fs42438-020-00211-7&partnerID=40&md5=8de96008e3c3a534269e6656c3e1b89f","Biodigitalism; Biohumanities; Bioinformationalism; Biopolitics; Convergence; Digital humanities; Epistemology; Knowledge ecology; Ontology; Philosophy; Postdigital; Posthumanism; Technoscience","English",Article,Scopus
"Flew T.","The Global Trust Deficit Disorder: A Communications Perspective on Trust in the Time of Global Pandemics",2021,"Journal of Communication",9,"10.1093/joc/jqab006","https://www.scopus.com/inward/record.uri?eid=2-s2.0-85120609070&doi=10.1093%2fjoc%2fjqab006&partnerID=40&md5=8e34f48211227861a4defdf888246e02","communications; conspiracy theories; COVID-19; digital platforms; mistrust; news; populism; Trust; truth","English",Article,Scopus
"Miao L., Yu C.","Reading Promotion Model for Local Digital Documentation Platforms Based on Big Data",2021,"Proceedings - 2021 2nd International Conference on Big Data and Informatization Education, ICBDIE 2021",,"10.1109/ICBDIE52740.2021.00052","https://www.scopus.com/inward/record.uri?eid=2-s2.0-85113371392&doi=10.1109%2fICBDIE52740.2021.00052&partnerID=40&md5=c0b52741533fb91f8b4811b392fa4e71","digital humanities; local literature; reading promotion","English",Conference Paper,Scopus
"Bourrier K., Anderson H., Jarmula S., Lapins D., MacAulay K., Peller P., Reiche I., Brosz J., Jacobson D.","Mapping Victorian Homes and Haunts: A Methodological Introduction",2021,"Journal of Victorian Culture",,"10.1093/jvcult/vcab003","https://www.scopus.com/inward/record.uri?eid=2-s2.0-85110558179&doi=10.1093%2fjvcult%2fvcab003&partnerID=40&md5=80f34df0e5d1821720edfb2d2c041fff","digital humanities; mapping; Victorian homes and haunts; Victorian literature; Victorian studies; women's writing","English",Review,Scopus
"Hosseini K., McDonough K., Van Strien D., Vane O., Wilson D.C.S.","Maps of a Nation? The Digitized Ordnance Survey for New Historical Research",2021,"Journal of Victorian Culture",4,"10.1093/jvcult/vcab009","https://www.scopus.com/inward/record.uri?eid=2-s2.0-85110499852&doi=10.1093%2fjvcult%2fvcab009&partnerID=40&md5=bfc0e7984a3764cdcd3b5993fcdd5af2","british history; computer vision; digital humanities; maps; ordnance survey; spatial history; victorian studies","English",Review,Scopus
"Lin S.-C., Kuo W.-C., Kuan Y.-S.","Review of studies on adolescent drug abuse in Taiwan",2021,"Taiwan Journal of Public Health",,"10.6288/TJPH.202104_40(2).109128","https://www.scopus.com/inward/record.uri?eid=2-s2.0-85109019420&doi=10.6288%2fTJPH.202104_40%282%29.109128&partnerID=40&md5=099c887ae9c6dd8323d86d580336aedf","Adolescent; Drug abuse; Review study","Chinese",Review,Scopus
"Marsocci V., Lastilla L.","POSE-ID-on-a novel framework for artwork pose clustering",2021,"ISPRS International Journal of Geo-Information",,"10.3390/ijgi10040257","https://www.scopus.com/inward/record.uri?eid=2-s2.0-85106514204&doi=10.3390%2fijgi10040257&partnerID=40&md5=9cd4e2d84d81bb6626a8b3e40fec8c3d","Digital humanities; Image retrieval; Pose clustering; Pose tracking; Warburg","English",Article,Scopus
"Kožuh A., Maksimović J., Zajić J.O.","Fourth industrial revolution and digital competences of teachers",2021,"World Journal on Educational Technology: Current Issues",3,"10.18844/wjet.v13i2.5651","https://www.scopus.com/inward/record.uri?eid=2-s2.0-85105860361&doi=10.18844%2fwjet.v13i2.5651&partnerID=40&md5=105de63acfc92572548584166acb9393","Digital competences; Education; Fourth Industrial Revolution; Serbia; Teachers","English",Article,Scopus
"Krishna R., Mu N., Keutzer K.","Applying Text Analytics to the Mind-section Literature of the Tibetan Tradition of the Great Perfection",2021,"ACM Transactions on Asian and Low-Resource Language Information Processing",,"10.1145/3392047","https://www.scopus.com/inward/record.uri?eid=2-s2.0-85105746600&doi=10.1145%2f3392047&partnerID=40&md5=fbaef8dac1817bb52f94de449a468fde","Digital humanities; natural language processing for low-resource languages; text analytics","English",Article,Scopus
"Soroya S.H., Ahmad A.S., Ahmad S., Soroya M.S.","Mapping internet literacy skills of digital natives: A developing country perspective",2021,"PLoS ONE",,"10.1371/journal.pone.0249495","https://www.scopus.com/inward/record.uri?eid=2-s2.0-85104549112&doi=10.1371%2fjournal.pone.0249495&partnerID=40&md5=b082e276c93e9ec24441378e1a02cadf",,"English",Article,Scopus
"Wills T.","Kennings and variability: Corpus and structural views",2021,"European Journal of Scandinavian Studies",,"10.1515/ejss-2020-2024","https://www.scopus.com/inward/record.uri?eid=2-s2.0-85104538764&doi=10.1515%2fejss-2020-2024&partnerID=40&md5=13d6e687c01af7ade8b6b495483a2025","corpus analysis; digital humanities; kennings; Old Norse; skaldic poetry; statistics","English",Article,Scopus
"Ngo V.M., Helmer S., Le-Khac N.-A., Kechadi M.-T.","Structural textile pattern recognition and processing based on hypergraphs",2021,"Information Retrieval Journal",1,"10.1007/s10791-020-09384-y","https://www.scopus.com/inward/record.uri?eid=2-s2.0-85099979245&doi=10.1007%2fs10791-020-09384-y&partnerID=40&md5=90045bab1dacd7351734356c713b9a4c","Clustering and similarity; Fabric; Graph matching; Textile modelling; Textile retrieval; Weaving","English",Article,Scopus
"Fuchs S.","Seeing more clearly",2021,"Nineteenth-Century Music Review",,"10.1017/S1479409819000685","https://www.scopus.com/inward/record.uri?eid=2-s2.0-85081664937&doi=10.1017%2fS1479409819000685&partnerID=40&md5=6ca36868161a53c53e986f3c5a69ed4e",,"English",Review,Scopus
"Platt H.","The digital humanities and nineteenth-century music: An introductory overview",2021,"Nineteenth-Century Music Review",1,"10.1017/S1479409820000014","https://www.scopus.com/inward/record.uri?eid=2-s2.0-85081374748&doi=10.1017%2fS1479409820000014&partnerID=40&md5=73d34c6703d5035fd27db97a2eb0176e",,"English",Review,Scopus
"Baldwin D., Costa D.J., Troy D.","Myaamiaataweenki eekincikoonihkiinki eeyoonki aapisaataweenki: A miami language digital tool for language reclamation",2021,"Digital Mapping and Indigenous America",,"10.4324/9780429295546-1-2","https://www.scopus.com/inward/record.uri?eid=2-s2.0-85104818685&doi=10.4324%2f9780429295546-1-2&partnerID=40&md5=862f22c5709bab911ef070aa84119008",,"English",Book Chapter,Scopus
"Hess J.B.","Digital mapping and indigenous america",2021,"Digital Mapping and Indigenous America",,"10.4324/9780429295546","https://www.scopus.com/inward/record.uri?eid=2-s2.0-85104811262&doi=10.4324%2f9780429295546&partnerID=40&md5=0b569f576d97bac8a25fe283cc63db0d",,"English",Book,Scopus
"Hackel S.W., Zerneke J., Zappia N.","Early california cultural atlas: Visualizing uncertainties within indigenous history",2021,"Digital Mapping and Indigenous America",,"10.4324/9780429295546-8-9","https://www.scopus.com/inward/record.uri?eid=2-s2.0-85104807606&doi=10.4324%2f9780429295546-8-9&partnerID=40&md5=f1382b6cbcfd52c80ae200012d261fda",,"English",Book Chapter,Scopus
"Hess J.B.","Mapping indigenous american cultures and living histories (MIAC-LH): A gathering place",2021,"Digital Mapping and Indigenous America",,"10.4324/9780429295546-12-13","https://www.scopus.com/inward/record.uri?eid=2-s2.0-85104787688&doi=10.4324%2f9780429295546-12-13&partnerID=40&md5=e004ef9ac8d1ce0903745301c26ec002",,"English",Book Chapter,Scopus
"Partanen N., Rießler M., Wilbur J.","Envisioning digital methods for fieldwork in the arctic",2021,"Visual Representations of the Arctic: Imagining Shimmering Worlds in Culture, Literature and Politics",,"10.4324/9781003158295-22","https://www.scopus.com/inward/record.uri?eid=2-s2.0-85104729788&doi=10.4324%2f9781003158295-22&partnerID=40&md5=17e4a76473f07ddefebc3c1746d8a4f0",,"English",Book Chapter,Scopus
"Temprano V.","Native land: Social media education and community voices",2021,"Digital Mapping and Indigenous America",,"10.4324/9780429295546-11-12","https://www.scopus.com/inward/record.uri?eid=2-s2.0-85104720888&doi=10.4324%2f9780429295546-11-12&partnerID=40&md5=9a267695f7254d832c7c1a27cbbe84f0",,"English",Book Chapter,Scopus
"Cameron F.R.","The future of digital data, heritage and curation: In a more-than-human world",2021,"The Future of Digital Data, Heritage and Curation: in a More-than-Human World",5,"10.4324/9781003149606","https://www.scopus.com/inward/record.uri?eid=2-s2.0-85104718448&doi=10.4324%2f9781003149606&partnerID=40&md5=b5e081fdbfff64dd95691444fc2c4e72",,"English",Book,Scopus
"Bartosch R.","Outlook: Education and the digital environmental humanities",2021,"Cultivating Sustainability in Language and Literature Pedagogy: Steps to an Educational Ecology",,"10.4324/9780429328985-9","https://www.scopus.com/inward/record.uri?eid=2-s2.0-85105155897&doi=10.4324%2f9780429328985-9&partnerID=40&md5=4eee5f9011dd68f34b0ef6aec421cb0d",,"English",Book Chapter,Scopus
"Rikap C.","Capitalism, power and innovation: Intellectual monopoly capitalism uncovered",2021,"Capitalism, Power and Innovation: Intellectual Monopoly Capitalism Uncovered",10,"10.4324/9780429341489","https://www.scopus.com/inward/record.uri?eid=2-s2.0-85104698841&doi=10.4324%2f9780429341489&partnerID=40&md5=341f21e64b6414482de3e271a8e052de",,"English",Book,Scopus
"Drucker J.","The digital humanities coursebook: An introduction to digital methods for research and scholarship",2021,"The Digital Humanities Coursebook: An Introduction to Digital Methods for Research and Scholarship",,"10.4324/9781003106531","https://www.scopus.com/inward/record.uri?eid=2-s2.0-85109228943&doi=10.4324%2f9781003106531&partnerID=40&md5=2ffb87562d856f5b03750d93a468186e",,"English",Book,Scopus
"Ballard S.","Art and Nature in the Anthropocene: Planetary Aesthetics",2021,"Art and Nature in the Anthropocene: Planetary Aesthetics",5,"10.4324/9780429328862","https://www.scopus.com/inward/record.uri?eid=2-s2.0-85109060205&doi=10.4324%2f9780429328862&partnerID=40&md5=6dd9fa6988331d7bbe386b3c5eca22b6",,"English",Book,Scopus
"Andrade-Arenas L., Nunez D.L., Sotomayor-Beltran C.","Leveraging digital tools for a better virtual teaching-learning process in a private university of Lima",2021,"EDUNINE 2021 - 5th IEEE World Engineering Education Conference: The Future of Engineering Education: Current Challenges and Opportunities, Proceedings",4,"10.1109/EDUNINE51952.2021.9429113","https://www.scopus.com/inward/record.uri?eid=2-s2.0-85107052559&doi=10.1109%2fEDUNINE51952.2021.9429113&partnerID=40&md5=a943a3b3f263d9ea1bf9d363b92d99ee","didactic; digital tools; teaching-learning; virtual","English",Conference Paper,Scopus
"Lara-Herrera J., Barriales A.L.F., Reyes-Del-Carmen H.","Impact on learning in a group of students of the Electrical Circuits course using a heuristic teaching system",2021,"EDUNINE 2021 - 5th IEEE World Engineering Education Conference: The Future of Engineering Education: Current Challenges and Opportunities, Proceedings",,"10.1109/EDUNINE51952.2021.9429125","https://www.scopus.com/inward/record.uri?eid=2-s2.0-85107028136&doi=10.1109%2fEDUNINE51952.2021.9429125&partnerID=40&md5=ae5cb19993fa6e2e49cd7deb249d88c2","electrical circuits; heuristics; meaningful learning; simulation","English",Conference Paper,Scopus
"Leigh A.","Information Use and the Shaping of Archives: Understanding Human-Information Interaction in Physical and Digital Archival Systems and the Role it Plays in Information Use",2021,"CHIIR 2021 - Proceedings of the 2021 Conference on Human Information Interaction and Retrieval",,"10.1145/3406522.3446010","https://www.scopus.com/inward/record.uri?eid=2-s2.0-85102746375&doi=10.1145%2f3406522.3446010&partnerID=40&md5=dafe3570ec0ebaf7c3943d7c7048b1ba","archives; information use; practice theory","English",Conference Paper,Scopus
"Lafia S., Kuhn W., Caylor K., Hemphill L.","Mapping research topics at multiple levels of detail",2021,"Patterns",3,"10.1016/j.patter.2021.100210","https://www.scopus.com/inward/record.uri?eid=2-s2.0-85101687678&doi=10.1016%2fj.patter.2021.100210&partnerID=40&md5=418269b70f57389619859c3f87fe93dd","data discovery; decision support; DSML 2: Proof-of-concept: Data science output has been formulated, implemented, and tested for one domain/problem; institutional review; knowledge representation; science mapping; spatialization; topic modeling","English",Article,Scopus
"Vaccarella M., Myers K.R.","Medical Humanities: Criticism and Creativity Breast Cancer Inside Out: Bodies, Biographies & Beliefs",2021,"Medical Humanities: Criticism and Creativity Breast Cancer Inside Out: Bodies, Biographies & Beliefs",,"10.3726/b14855","https://www.scopus.com/inward/record.uri?eid=2-s2.0-85107849372&doi=10.3726%2fb14855&partnerID=40&md5=5663b11452b3850e8a90b5f889619a90",,"English",Book,Scopus
"Stokes P.A.","Holistically Modelling the Medieval Book: Towards a Digital Contribution",2021,"Anglia",,"10.1515/ang-2021-0002","https://www.scopus.com/inward/record.uri?eid=2-s2.0-85104341916&doi=10.1515%2fang-2021-0002&partnerID=40&md5=4f1956a8f0699764341ad4e5f950bf71","codicology; Digital Humanities; Linked Open Data; Manuscript Studies; modelling; ontologies; palaeography; textual criticism","English",Article,Scopus
"Rippl G., Lenker U.","Book Histories in the Digital Age: Challenges, Promises, Achievements",2021,"Anglia",,"10.1515/ang-2021-0001","https://www.scopus.com/inward/record.uri?eid=2-s2.0-85104304665&doi=10.1515%2fang-2021-0001&partnerID=40&md5=803fed624c03c2ad166902d9cf5db527","copyright; democratization of reception; digital photography; digitization; manuscript cataloguing; materiality of the book; medieval manuscripts; philology","English",Article,Scopus
