"Panagiotidou G., Vandam R., Poblome J., Vande Moere A.","Implicit Error, Uncertainty and Confidence in Visualization: an Archaeological Case Study",2021,"IEEE Transactions on Visualization and Computer Graphics",1,"10.1109/TVCG.2021.3088339","https://www.scopus.com/inward/record.uri?eid=2-s2.0-85112422701&doi=10.1109%2fTVCG.2021.3088339&partnerID=40&md5=1def189110efe8317bbc5534592689b4","archaeology; Cognition; Data visualization; Decision making; digital humanities; Encoding; human-centered computing; implicit error; Probes; qualitative study; Uncertainty; uncertainty visualization; Visual analytics","English",Article,Scopus
"Sandoval C., Pirogova E., Lech M.","Adversarial learning approach to unsupervised labeling of fine art paintings",2021,"IEEE Access",2,"10.1109/ACCESS.2021.3086476","https://www.scopus.com/inward/record.uri?eid=2-s2.0-85112399142&doi=10.1109%2fACCESS.2021.3086476&partnerID=40&md5=23aaa9fdc6b457c224f93803f411b4bb","Adversarial learning; Art classification; Data labeling; Deep learning; Digital humanity; Optimization; Transfer learning; Unsupervised clustering","English",Article,Scopus
"Majhi D., Mentor S.J., Nath A., Kerketta S.","DDC-wise subject mapping of NDLI indexed multileveled, multilingual resources: A special reference with Indian Languages",2021,"Library Philosophy and Practice",,,"https://www.scopus.com/inward/record.uri?eid=2-s2.0-85112294765&partnerID=40&md5=b8eb45a22fc5006a5c6a402a4787648f","IIT Kharagpur; Indian languages; NDLI; Subject mapping; virtual learning platform","English",Article,Scopus
"Lucchiari C., Folgieri R., Gaevskaya E., Borisov N.","Digital humanities competencies development in various learning environments",2021,"CEUR Workshop Proceedings",1,,"https://www.scopus.com/inward/record.uri?eid=2-s2.0-85112235379&partnerID=40&md5=052c65dde2c32bab32a562c927e41f23","ARCS Model; Blended Learning; Digital Competences; Digital Humanities; Digital Pedagogics; ELearning; Learning Design; Life Long Learning; Personal Meaning Maps; Technological Pedagogical Content Knowledge","English",Conference Paper,Scopus
[No author name available],"NESinMIS 2021 - Proceedings of the 16th International Conference ""New Educational Strategies in Modern Information Space""",2021,"CEUR Workshop Proceedings",,,"https://www.scopus.com/inward/record.uri?eid=2-s2.0-85112182445&partnerID=40&md5=0e1b925bdf70540cacce711530afc071",,"English",Conference Review,Scopus
"Bala’awi F., Mubaideen S., Smithies J., Flohr P., Esposito A., Palmer C., Idwan S.","The MaDiH (مديح): Mapping Digital Cultural Heritage in Jordan, Opportunities and Limitations",2021,"Lecture Notes in Computer Science (including subseries Lecture Notes in Artificial Intelligence and Lecture Notes in Bioinformatics)",,"10.1007/978-3-030-77411-0_2","https://www.scopus.com/inward/record.uri?eid=2-s2.0-85112173099&doi=10.1007%2f978-3-030-77411-0_2&partnerID=40&md5=2a3f76697c3e86c518b77dd83bffc8fe","Communication strategy; Datasets; Digital Cultural Heritage; Documentation; Infrastructure and digital tools; Jordan; MaDiH CKAN repository","English",Conference Paper,Scopus
"Grieggs S., Shen B., Rauch G., Li P., Ma J., Chiang D., Price B., Scheirer W.","Measuring Human Perception to Improve Handwritten Document Transcription",2021,"IEEE Transactions on Pattern Analysis and Machine Intelligence",,"10.1109/TPAMI.2021.3092688","https://www.scopus.com/inward/record.uri?eid=2-s2.0-85112169268&doi=10.1109%2fTPAMI.2021.3092688&partnerID=40&md5=a05afed30a1af3d77b69c1c34595b880","Annotations; Computer vision; Deep Learning; Digital Humanities; Document Transcription; Loss measurement; Task analysis; Tools; Training; Visual Psychophysics; Visual Recognition; Visualization","English",Article,Scopus
"Medina E.F., Somoza Y.P., Andrade-Arenas L., Zavaleta J.C., Alva R.Y., Vargas S.V.","Analysis of Distance Learning in the Professional School of Systems Engineering and Informatics",2021,"International Journal of Advanced Computer Science and Applications",3,"10.14569/IJACSA.2021.0120763","https://www.scopus.com/inward/record.uri?eid=2-s2.0-85112140273&doi=10.14569%2fIJACSA.2021.0120763&partnerID=40&md5=6935e702d66ae6f5c54ee1c704b7cf31","Distance modality; evaluation; focus group; resources and pedagogical materials; teaching strategy","English",Article,Scopus
"Nugroho M., Cahyono B.","How to Push Digital Ecosystem to Explore Digital Humanities and Collaboration of SMEs",2021,"Lecture Notes in Networks and Systems",,"10.1007/978-3-030-79725-6_27","https://www.scopus.com/inward/record.uri?eid=2-s2.0-85112009326&doi=10.1007%2f978-3-030-79725-6_27&partnerID=40&md5=3fa8e6b6a06844c09572a91afb1c7fb5","Agility planning strategy; Digital ecosystem; Digital humanity and collaboration; Green management; Theory Acceptance Model","English",Conference Paper,Scopus
"Nanetti A., Radzi Z., Benvenuti D.","Crafting the Next Generation of Web-based Learning Tools for Manuscript Artefacts in the Time of the COVID-19 Pandemic. A Focus oN sCiENCE, TECHNoLoGY, AND ENGiNEERiNG CoDiCEs, WoRLD MAPs, AND ARcHiVAL DocuMENTs iN EXHiBiTioN sETTiNGs",2021,"SCIRES-IT",,"10.2423/i22394303v11n1p97","https://www.scopus.com/inward/record.uri?eid=2-s2.0-85111717707&doi=10.2423%2fi22394303v11n1p97&partnerID=40&md5=62e82a70898f98df78d37dfecaf17c85","2D and 3D Web-based Reproductions; and Engineering Manuscripts; Archival Documents; Digital Humanities; Engineering Historical Memory; Science; Technology; Web-based Learning Tools for Exhibition Settings; World Maps","English",Article,Scopus
"Urban M.","Not suitable for outsiders: Social network analysis of slovak cinema from 2012 to 2019 [Stáť na okraji sa neopláca: Analýza sociálnej siete slovenského filmu z rokov 2012 – 2019]",2021,"Slovenske Divadlo",,"10.31577/SD-2021-0014","https://www.scopus.com/inward/record.uri?eid=2-s2.0-85111658625&doi=10.31577%2fSD-2021-0014&partnerID=40&md5=000c1d8f6674e077a00c4b1647a2753a",,"Slovak",Review,Scopus
"Ray A.","Post-memory and the third generation’s inheritance of the Indian partition (1947): A comparative study of the linguistic register across spatial axes",2021,"Memory Studies",,"10.1177/17506980211033324","https://www.scopus.com/inward/record.uri?eid=2-s2.0-85111656713&doi=10.1177%2f17506980211033324&partnerID=40&md5=5a90120f413dffe115802ecdb00274ec","digital humanities; Indian partition; linguistic register; post-memory; third generation","English",Article,Scopus
"François P., Leichman J., Laroche F., Rubellin F.","VIRTUAL REALITY AS A VERSATILE TOOL FOR RESEARCH, DISSEMINATION AND MEDIATION IN THE HUMANITIES [LA REALIDAD VIRTUAL COMO HERRAMIENTA VERSÁTIL DE INVESTIGACIÓN, DIFUSIÓN Y MEDIACIÓN EN LAS HUMANIDADES]",2021,"Virtual Archaeology Review",4,"10.4995/var.2021.14880","https://www.scopus.com/inward/record.uri?eid=2-s2.0-85111606902&doi=10.4995%2fvar.2021.14880&partnerID=40&md5=b44da3d645d6bd5baca72ac962aa011b","digital reconstruction; historia; history; investigación; mediación; mediation; reconstrucción digital; research; restitución; restitution; teatro; theatre","English; Spanish",Article,Scopus
"Peebles K.D., Scarlatta G.","Epilogue: Future Directions for Studying the Life and Legacy of Renée de France",2021,"Queenship and Power",,"10.1007/978-3-030-69121-9_13","https://www.scopus.com/inward/record.uri?eid=2-s2.0-85111580948&doi=10.1007%2f978-3-030-69121-9_13&partnerID=40&md5=5d3b23e03b78e4ca6bb794bfea4e2065",,"English",Book Chapter,Scopus
"Führ F., Bisset Alvarez E.","Digital Humanities and Open Science: Initial Aspects",2021,"Lecture Notes of the Institute for Computer Sciences, Social-Informatics and Telecommunications Engineering, LNICST",1,"10.1007/978-3-030-77417-2_12","https://www.scopus.com/inward/record.uri?eid=2-s2.0-85111402737&doi=10.1007%2f978-3-030-77417-2_12&partnerID=40&md5=6ed77b6235b5dafd6dbbc3f5e4428562","Bibliometric; Data mining; Digital humanities; Open science; Scientific production","English",Conference Paper,Scopus
"Glazkova A., Kruzhinov V., Sokova Z.","Automatic Text Processing for Historical Research",2021,"Communications in Computer and Information Science",,"10.1007/978-3-030-78273-3_14","https://www.scopus.com/inward/record.uri?eid=2-s2.0-85111393104&doi=10.1007%2f978-3-030-78273-3_14&partnerID=40&md5=ff63b882916e3278dfc70faa9be8c31a","Digital humanities; Historical methodology; Information extraction; Natural language processing; Text mining","English",Conference Paper,Scopus
"Getlík P.","The possibilities and challenges of quantitative modelling of the fictional semantics of colours – a close look at distant reading [Možnosti a výzvy kvantitatívneho modelovania fikčnej sémantiky farieb – blízky pohľad na čítanie z diaľky]",2021,"Slovenska Literatura",,"10.31577/slovlit.2021.68.4.5","https://www.scopus.com/inward/record.uri?eid=2-s2.0-85111390639&doi=10.31577%2fslovlit.2021.68.4.5&partnerID=40&md5=789639901906587836fc38ade47055d5","Cognitive literary studies; Colour semantics; Distant reading; Jan Čep; Quantitative modelling; Richard Změlík","Slovak",Article,Scopus
"Debnár M.","Quantitative comparatistics in literary studies [Kvantitatívna komparatistika v literárnovednom výskume]",2021,"Slovenska Literatura",,"10.31577/slovlit.2020.68.4.6","https://www.scopus.com/inward/record.uri?eid=2-s2.0-85111382993&doi=10.31577%2fslovlit.2020.68.4.6&partnerID=40&md5=f6d9d08986d55042efc7539989566f6c","Author corpora; Digital Humanities; Distant reading; Jan Čep; Quantitative methods; Richard Změlík","Slovak",Article,Scopus
[No author name available],"2nd EAI International Conference on Data and Information in Online Environments, DIONE 2021",2021,"Lecture Notes of the Institute for Computer Sciences, Social-Informatics and Telecommunications Engineering, LNICST",,,"https://www.scopus.com/inward/record.uri?eid=2-s2.0-85111364865&partnerID=40&md5=90e5b2a32237c512f92af9d853a02b2e",,"English",Conference Review,Scopus
"Seaman D., Ivins O.","The future of digitized materials: Where we have been and where we’re going",2021,"Transforming Serials: The Revolution Continues",,"10.1300/J123v44n12_06","https://www.scopus.com/inward/record.uri?eid=2-s2.0-85111334237&doi=10.1300%2fJ123v44n12_06&partnerID=40&md5=0ef619b51395709c39d22e04cc363dd7",,"English",Book Chapter,Scopus
"Palladino C.","Mapping the unmapped: Transmedial representations of premodern geographies [Mapping the unmapped: Transmediale Darstellungen vormoderner Geographien]",2021,"Berichte Geographie und Landeskunde",,"10.25162/BGL-2021-0008","https://www.scopus.com/inward/record.uri?eid=2-s2.0-85111302759&doi=10.25162%2fBGL-2021-0008&partnerID=40&md5=7522c1b0403a6cfaadd95f5613ec2803","Digital humanities; Spatial modeling; Spatial narrative","English",Article,Scopus
"Krelová K.K., Berková K., Krpálek P., Kubišová A.","Attitudes of Czech college students toward digital literacy and their technical aids in times of COVID-19",2021,"International Journal of Engineering Pedagogy",3,"10.3991/IJEP.V11I4.20821","https://www.scopus.com/inward/record.uri?eid=2-s2.0-85111205434&doi=10.3991%2fIJEP.V11I4.20821&partnerID=40&md5=b4e0c7a22d580e3386a2008d5135a3c0","Digital literacy; Economic and humanities studies; Education; Form of education","English",Article,Scopus
"Chagnaud C., Brun-Trigaud G., Garat P.","Identification of clusters of lexical areas using geographical factors: A case study in the Occitan language area",2021,"Studies in Language Variation",,"10.1075/silv.25.09cha","https://www.scopus.com/inward/record.uri?eid=2-s2.0-85111092057&doi=10.1075%2fsilv.25.09cha&partnerID=40&md5=a1e05998261e0a1582cb4eb782f88bb2","Clustering; Digital humanities; Geolinguistics; Geovisualisation; Occitan language; Statistics","English",Book Chapter,Scopus
"Yáñez-Bouza N.","Methodological approaches to the study of codification, prescription, and prescriptivism",2021,"Studia Neophilologica",,"10.1080/00393274.2021.1934108","https://www.scopus.com/inward/record.uri?eid=2-s2.0-85111041932&doi=10.1080%2f00393274.2021.1934108&partnerID=40&md5=60dcd849c9f75a4db33cbd48f544cc76","grammars; Prescriptivism; pronouncing dictionaries; standardisation; usage guides","English",Article,Scopus
"Hillnhuetter S., Klamm S., Tietjen F.","Hybrid photography: Intermedial practices in science and humanities",2021,"Hybrid Photography: Intermedial Practices in Science and Humanities",,"10.4324/9781003157854","https://www.scopus.com/inward/record.uri?eid=2-s2.0-85110660338&doi=10.4324%2f9781003157854&partnerID=40&md5=18053e32b5ffe6175a6ce095356625ad",,"English",Book,Scopus
"Cantón C.I.M.","[en] A Quantitative Analysis of Open Access in Digital Humanities Journals [Un análisis cuantitativo del acceso abierto en las revistas de Humanidades Digitales]",2021,"Revista General de Informacion y Documentacion",1,"10.5209/rgid.76948","https://www.scopus.com/inward/record.uri?eid=2-s2.0-85110618980&doi=10.5209%2frgid.76948&partnerID=40&md5=2caf35936037be01fb0dd5a0ab4911b9","Academic Journals; Acceso abierto; Ciencia abierta; Digital Humanities; Humanidades Digitales; Open Access; Open Science; Publicaciones periódicas; Revistas académicas; Scholarly Journals","English; Spanish",Article,Scopus
"Noordegraaf J., van Erp M., Zijdeman R., Raat M., van Oort T., Zandhuis I., Vermaut T., Mol H., van der Sijs N., Doreleijers K., Baptist V., Vrielink C., Assendelft B., Rasterhoff C., Kisjes I.","Semantic Deep Mapping in the Amsterdam Time Machine: Viewing Late 19th- and Early 20th-Century Theatre and Cinema Culture Through the Lens of Language Use and Socio-Economic Status",2021,"Communications in Computer and Information Science",1,"10.1007/978-3-030-93186-5_9","https://www.scopus.com/inward/record.uri?eid=2-s2.0-85110410806&doi=10.1007%2f978-3-030-93186-5_9&partnerID=40&md5=4834f8eff3cf3de337070a0093f164df","Deep mapping; Digital humanities; Linguistics; Media studies; Semantic web; Social and economic history; Urban history","English",Conference Paper,Scopus
"Qi Z., Chuan J., Youshu J., Minxuan F., Bin L., Chao X., Liu L.","Unified model for word segmentation and pos tagging of multi-domain pre-qin literature",2021,"Data Analysis and Knowledge Discovery",1,"10.11925/infotech.2096-3467.2019.1032","https://www.scopus.com/inward/record.uri?eid=2-s2.0-85110368458&doi=10.11925%2finfotech.2096-3467.2019.1032&partnerID=40&md5=8225278e1fcfb98b3f257c866bf5a606","Ancient Books Intelligent Processing; Deep Learning; Digital Humanities; Part-of-Speech Tagging; Pre-Qin Literature; Word Segmentation","Chinese",Article,Scopus
"Qian W., Dongbo W., Bin L., Chao X.","Deep learning based automatic sentence segmentation and punctuation model for massive classical chinese literature",2021,"Data Analysis and Knowledge Discovery",,"10.11925/infotech.2096-3467.2019.1033","https://www.scopus.com/inward/record.uri?eid=2-s2.0-85110261900&doi=10.11925%2finfotech.2096-3467.2019.1033&partnerID=40&md5=fe18cc93140308eeb0bc28c681136874","Ancient Chinese; Automatic Sentence Segmentation; BERT; Digital Humanities","Chinese",Article,Scopus
"Gottschalk P.","Foundations oF Comparison: Finding Home in a material Field site, a digital Field site, and a Virtual Village",2021,"Fieldwork in Religion",,"10.1558/firn.18357","https://www.scopus.com/inward/record.uri?eid=2-s2.0-85110032076&doi=10.1558%2ffirn.18357&partnerID=40&md5=2c72180d04598f931023b2bf166acf57","anthropology; comparison; digital humanities; ethnography; Hinduism; India; Islam; religion","English",Article,Scopus
"Bennato D.","The Digital Traces’ Diamond. A Proposal to Put Together a Quantitative Approach, Interpretive Methods, and Computational Tools",2021,"Italian Sociological Review",1,"10.13136/isr.v11i4S.432","https://www.scopus.com/inward/record.uri?eid=2-s2.0-85109799966&doi=10.13136%2fisr.v11i4S.432&partnerID=40&md5=9eef116fba7324b173ebc6ac218880d9","cultural diamond; digital sociology; digital traces","English",Article,Scopus
"Callahan V., Richter N., Lane C., Fisher D.C.","In the mix, the collaborative remix to repair, reconnect, rebuild",2021,"The Routledge Handbook of Remix Studies and Digital Humanities",,"10.4324/9780429355875-12","https://www.scopus.com/inward/record.uri?eid=2-s2.0-85109788062&doi=10.4324%2f9780429355875-12&partnerID=40&md5=da69aff6a52c3f2e34dbff97b41f2a5b",,"English",Book Chapter,Scopus
"De Bruin-Molé M.","Monster theory 2.0: Remix, the digital humanities, and the limits of transgression",2021,"The Routledge Handbook of Remix Studies and Digital Humanities",,"10.4324/9780429355875-7","https://www.scopus.com/inward/record.uri?eid=2-s2.0-85109782085&doi=10.4324%2f9780429355875-7&partnerID=40&md5=21254de45c570df73c80701788638c92",,"English",Book Chapter,Scopus
"Navas E., Gallagher O., Burrough X.","The routledge handbook of remix studies and digital humanities",2021,"The Routledge Handbook of Remix Studies and Digital Humanities",1,"10.4324/9780429355875","https://www.scopus.com/inward/record.uri?eid=2-s2.0-85109775471&doi=10.4324%2f9780429355875&partnerID=40&md5=915b58056ae2cc109e1369c8e0696ca6",,"English",Book,Scopus
"Kuhn V.","Production plus consumption: Remix and the digital humanities",2021,"The Routledge Handbook of Remix Studies and Digital Humanities",,"10.4324/9780429355875-4","https://www.scopus.com/inward/record.uri?eid=2-s2.0-85109728066&doi=10.4324%2f9780429355875-4&partnerID=40&md5=8f9894ecd88f78642c5b4efbe1ee3519",,"English",Book Chapter,Scopus
"Plaut E.","Vandalize a webpage: Automation and agency, destruction and repair",2021,"The Routledge Handbook of Remix Studies and Digital Humanities",,"10.4324/9780429355875-23","https://www.scopus.com/inward/record.uri?eid=2-s2.0-85109724060&doi=10.4324%2f9780429355875-23&partnerID=40&md5=01ff312c442c9caedf4548a34a7e9097",,"English",Book Chapter,Scopus
"Delaney A.","Remixing the object of study: Performing screen studies through videographic scholarship",2021,"The Routledge Handbook of Remix Studies and Digital Humanities",,"10.4324/9780429355875-29","https://www.scopus.com/inward/record.uri?eid=2-s2.0-85109684389&doi=10.4324%2f9780429355875-29&partnerID=40&md5=9ac08563669852a36c95a54993424b8d",,"English",Book Chapter,Scopus
"Church S.H., Feller G.","Internet memes as remixes: Simpsons memes and the swarm archive",2021,"The Routledge Handbook of Remix Studies and Digital Humanities",,"10.4324/9780429355875-17","https://www.scopus.com/inward/record.uri?eid=2-s2.0-85109666148&doi=10.4324%2f9780429355875-17&partnerID=40&md5=b1e25bec110a42d5f55f4fce2e1c121d",,"English",Book Chapter,Scopus
"Navas E.","RS (remix studies) + DH (digital humanities): Critical reflections on chance and strategy for empathy",2021,"The Routledge Handbook of Remix Studies and Digital Humanities",,"10.4324/9780429355875-9","https://www.scopus.com/inward/record.uri?eid=2-s2.0-85109661091&doi=10.4324%2f9780429355875-9&partnerID=40&md5=9ec46c859a93a1532529e42b47ddced5",,"English",Book Chapter,Scopus
"Gallagher O.","Remix games as instruments of digital humanities scholarship: Harnessing the potential of virtual worlds",2021,"The Routledge Handbook of Remix Studies and Digital Humanities",,"10.4324/9780429355875-27","https://www.scopus.com/inward/record.uri?eid=2-s2.0-85109636991&doi=10.4324%2f9780429355875-27&partnerID=40&md5=e7adf38174b75996cd403987717ea882",,"English",Book Chapter,Scopus
"Grba D.","Always already just: Combinatorial inventiveness in new media art",2021,"The Routledge Handbook of Remix Studies and Digital Humanities",,"10.4324/9780429355875-25","https://www.scopus.com/inward/record.uri?eid=2-s2.0-85109636842&doi=10.4324%2f9780429355875-25&partnerID=40&md5=d494b8010d4f6e970340589eca5e7565",,"English",Book Chapter,Scopus
"Campbell M.V.","Djing archival interruptions: A remix praxis and reflective guide",2021,"The Routledge Handbook of Remix Studies and Digital Humanities",,"10.4324/9780429355875-33","https://www.scopus.com/inward/record.uri?eid=2-s2.0-85109624130&doi=10.4324%2f9780429355875-33&partnerID=40&md5=5579e5d5728f53e91a6cf34f073762ea",,"English",Book Chapter,Scopus
"Renzo A.","Exploring remix process: The case of the spanish megamix",2021,"The Routledge Handbook of Remix Studies and Digital Humanities",,"10.4324/9780429355875-34","https://www.scopus.com/inward/record.uri?eid=2-s2.0-85109617703&doi=10.4324%2f9780429355875-34&partnerID=40&md5=39388a2c8ab05e22a0743f59d0d8fd99",,"English",Book Chapter,Scopus
"Burdick A.","Designing the remix library",2021,"The Routledge Handbook of Remix Studies and Digital Humanities",,"10.4324/9780429355875-10","https://www.scopus.com/inward/record.uri?eid=2-s2.0-85109609915&doi=10.4324%2f9780429355875-10&partnerID=40&md5=b1ba157eb41f98cf0db2fe71782b5158",,"English",Book Chapter,Scopus
"Hassapopoulou M., Cameron D., Cajulis C., Kim Y., Lauderdale J., Hahn E., Cabello P., Lee H., Yun S.E., Christensen K., Anderson-Song K.","Hacking the digital humanities: Critical practice and DIY pedagogy",2021,"The Routledge Handbook of Remix Studies and Digital Humanities",,"10.4324/9780429355875-32","https://www.scopus.com/inward/record.uri?eid=2-s2.0-85109608513&doi=10.4324%2f9780429355875-32&partnerID=40&md5=ae98661b33fea2dd92c475cc26ffff92",,"English",Book Chapter,Scopus
"Ludovico A.","Machine-driven text remixes",2021,"The Routledge Handbook of Remix Studies and Digital Humanities",,"10.4324/9780429355875-20","https://www.scopus.com/inward/record.uri?eid=2-s2.0-85109607882&doi=10.4324%2f9780429355875-20&partnerID=40&md5=2f323d8f42ced288e1c9e9d6e3ac08c0",,"English",Book Chapter,Scopus
"Bradbury V.","Hack it! diy divine tools: An art hack implemented as new media pedagogy in the public liberal arts",2021,"The Routledge Handbook of Remix Studies and Digital Humanities",,"10.4324/9780429355875-15","https://www.scopus.com/inward/record.uri?eid=2-s2.0-85109604440&doi=10.4324%2f9780429355875-15&partnerID=40&md5=106984e1272f67742faaa773dee12a9a",,"English",Book Chapter,Scopus
"De Moura E.","Sampling new literacies: Remix studies and digital humanities in a cross-disciplinary approach",2021,"The Routledge Handbook of Remix Studies and Digital Humanities",,"10.4324/9780429355875-8","https://www.scopus.com/inward/record.uri?eid=2-s2.0-85109603157&doi=10.4324%2f9780429355875-8&partnerID=40&md5=5134b1d2024f0cec766d5a7d8f8ef8c8",,"English",Book Chapter,Scopus
"Watkins P.","The sound of the future: A digital humanities remix essay",2021,"The Routledge Handbook of Remix Studies and Digital Humanities",,"10.4324/9780429355875-31","https://www.scopus.com/inward/record.uri?eid=2-s2.0-85109594948&doi=10.4324%2f9780429355875-31&partnerID=40&md5=17b707e6ee95495cd3034c00d0a7e6a2",,"English",Book Chapter,Scopus
"Wilson J.","On the capabilities of hip hop-inspired design research: An annotated syllabus",2021,"The Routledge Handbook of Remix Studies and Digital Humanities",,"10.4324/9780429355875-16","https://www.scopus.com/inward/record.uri?eid=2-s2.0-85109589227&doi=10.4324%2f9780429355875-16&partnerID=40&md5=93359e7dbd1884839e775936642122cd",,"English",Book Chapter,Scopus
"McArthur I.","Interdisciplinary design and transcultural collaboration as transformative remix tools",2021,"The Routledge Handbook of Remix Studies and Digital Humanities",,"10.4324/9780429355875-11","https://www.scopus.com/inward/record.uri?eid=2-s2.0-85109589156&doi=10.4324%2f9780429355875-11&partnerID=40&md5=dfa51cf74ca54498f336a21d1a7b7d5f",,"English",Book Chapter,Scopus
"Burrough X.","Poetically remixing the archive",2021,"The Routledge Handbook of Remix Studies and Digital Humanities",,"10.4324/9780429355875-18","https://www.scopus.com/inward/record.uri?eid=2-s2.0-85109588122&doi=10.4324%2f9780429355875-18&partnerID=40&md5=af3e5bf5d8523ed453a80ff1171d3e60",,"English",Book Chapter,Scopus
"Arkhangelsky A.N., Novikova A.A.","A Transmedia Turn in Educational Strategies: Storytelling in Teaching Literature to School Students [Трансмедийный поворот в стратегиях обучения: нарративные практики на уроках литературы]",2021,"Voprosy Obrazovaniya / Educational Studies Moscow",1,"10.17323/1814-9545-2021-2-63-81","https://www.scopus.com/inward/record.uri?eid=2-s2.0-85109428081&doi=10.17323%2f1814-9545-2021-2-63-81&partnerID=40&md5=4a4e44879395f7cbe793541346377b74","action-based learning; narrative-based learning; pedagogy of art; school literary canon; transmediality","English; Russian",Article,Scopus
"Greyling F., Verhoef S., Tempelhoff G.","The byderhand pioneer project: A case study of the participatory dynamics in creating and accessibilising locative literature for persons with visual impairment [Die Byderhand-Pionierprojek:'n Gevallestudie van die deelnemende dinamika in die skep en toeganklikmaking van lokatiewe literatuur vir persone met siggestremdheid]",2021,"Tydskrif vir Geesteswetenskappe",1,"10.17159/2224-7912/2020/V60N4-2A14","https://www.scopus.com/inward/record.uri?eid=2-s2.0-85109424810&doi=10.17159%2f2224-7912%2f2020%2fV60N4-2A14&partnerID=40&md5=962de750620dbac44cca6be5c5e7047e","Accessibility; Applied electronic literature studies; Co-design; Collaboration; Digital literature; Interface design; Locative literature; Multisensory garden; Participating dynamics; Participatory approach; Practice based research; Site specific literature; Visual impairment","Afrikaans",Review,Scopus
"Scopsi C.","Issues and principles of a descriptive model of memory collections [Enjeux et principes d’un modèle descriptif des Collectes de mémoires]",2021,"Signata",,"10.4000/SIGNATA.3085","https://www.scopus.com/inward/record.uri?eid=2-s2.0-85109067507&doi=10.4000%2fSIGNATA.3085&partnerID=40&md5=e14b3e1c5e8bbf83c339ea0ae6963deb","Collected memories; Curation; Digital archives; Model of description; Modelization","French",Article,Scopus
